438;Y_PNF_15;489;91;0;0;0;1;Gruyère, dormir, manger, se marer, dormir, chambres, déjeuner, foot, grillade, disco, dormir, partir;12;0;0;NA;et (6), après (3), le lendemain;3;1;0;1;3;2;0;2;3;0;3;NA;9;NA;NA;10;0;0;0;1;X, familia;2;0;0;NA;0;0;1;0;1;1;1;1;1;1;0;0;1;NA;82;0;0;0;1;x, attractions, amies, manger, place, belle vie, demande, pour sortir avec quelqu'un qui l'aimait ;7;0;0;NA;NA;0;1;0;1;3;2;0;2;2;2;6;NA;9;;NA;0;NA;NA;NA;NA;NA;NA;NA;NA;NA;NA;NA;NA;0;NA;NA;NA;NA;NA;NA;NA;NA;NA;a écrit en français;43;0;0;0;1;sortir, acheter, macdo, rentrer, ramener des choses;5;0;0;NA;et après, et;2;1;0;1;1;2;0;0;4;0;2;NA;3;;NA;15;0;0;0;1;dia de férias, pai, geneve, madrinha, hospital;5;0;0;NA;0;0;1;0;1;1;2;0;2;3;0;0;2;NA;PNF;f;1;f1;1;484;30;0;0;1;0;0;1;1;3;4;2;1;2;1;0;1;3;1;0;NA;3;NA;18;0;0;0;0;0;0;1;1;2;1;0;1;1;0;2;3;0;0;NA;4;34;0;0;1;0;0;1;1;2;3;0;1;1;3;0;2;2;1;0;NA;1;NA;15;0;0;1;0;0;1;1;1;2;0;1;1;1;0;2;0;0;0;NA;4;49;0;0;1;1;0;2;1;3;4;2;1;1;2;1;1;3;1;0;NA;1;NA;NA;0;0;0;0;0;NA;1;1;NA;1;0;1;2;1;2;3;NA;NA;NA;3
439;Y_PNF_16;490;18;0;0;0;1;Terrain de foot, jouer, se faire planter un clou;3;0;0;NA;NA;0;1;0;1;1;1;1;1;1;0;0;NA;3;NA;NA;14;0;0;0;1;Montanha, ski, comer;3;0;0;NA;0;0;1;0;1;1;2;1;1;1;0;0;2;Ortographe du FR;31;0;0;0;1;Gruyère, marche, baby luge, minigolf, jeux, disco;6;0;0;NA;NA;0;1;0;1;1;2;1;2;2;0;1;NA;3;;NA;13;0;0;0;1;Portugal, bicicleta, ajudar;3;0;0;NA;0;0;1;0;1;1;2;2;2;4;0;0;4;NA;18;0;0;0;1;zoo, animaux, oiseaux, lézards, serpents;5;0;0;NA;NA;0;1;0;1;1;2;2;2;1;0;1;NA;0;;NA;3;0;0;0;0;dia;1;0;0;NA;0;0;0;0;0;NA;1;1;0;1;0;0;0;NA;PNF;f;1;f1;1;485;23;0;0;1;0;1;2;1;3;4;3;1;2;1;1;2;1;0;1;NA;0;NA;26;0;0;1;0;0;1;1;3;4;1;1;2;1;1;2;3;0;0;NA;1;24;0;0;0;0;0;0;1;3;4;1;0;1;1;1;2;3;0;0;NA;3;NA;13;0;0;0;0;0;0;1;3;4;1;0;1;1;0;2;3;0;0;NA;1;24;0;0;0;0;0;0;1;3;4;1;0;2;1;1;2;3;0;0;NA;1;NA;16;0;0;0;0;0;0;1;3;4;1;0;1;1;1;2;3;0;0;NA;4
440;Y_PNF_17;491;18;0;1;1;1;novelles amies, x;3;0;0;NA;NA;0;0;0;0;NA;1;0;2;2;0;1;NA;NA;NA;Impossible de reconaître les verbes ou les temps;14;0;1;1;1;Ski, Portugal, ferias, X;4;0;0;NA;0;0;1;0;1;1;2;1;1;2;0;0;4;NA;22;0;0;0;1;forêt, marcher, manger, quelqu'un s'est blessé;4;0;0;NA;et;1;1;0;1;1;2;0;0;2;0;0;NA;4;;NA;17;0;0;0;1;Portugal, chegar, avô, nascer, morrer;5;0;0;NA;0;0;1;0;1;1;2;0;2;2;0;0;4;NA;34;0;0;0;1;Fribourg, magazins, bagarre, se pardonner, idée;5;0;0;NA;NA;0;1;0;1;3;2;1;1;3;0;1;NA;0;;NA;33;0;0;0;1;paris, tour eiffel, amigo, amiga, maus, bater, chorar, desculpa, acabar, adorar ;10;0;0;NA;depois;1;1;0;1;3;3;2;1;4;0;0;3;NA;PNF;f;1;f1;1;486;21;0;0;0;0;1;1;1;2;3;1;0;1;1;0;1;2;0;0;NA;1;NA;23;0;0;0;0;1;1;1;2;3;1;0;2;1;0;2;2;0;0;NA;1;17;0;0;0;0;1;1;1;3;4;1;0;1;1;1;2;3;0;0;NA;1;NA;18;0;0;0;0;0;0;1;3;4;0;0;1;1;1;2;3;0;0;NA;2;50;0;0;1;0;0;1;1;3;4;1;1;2;1;1;2;4;0;0;NA;0;NA;53;0;0;1;0;1;2;1;3;4;3;1;1;2;1;2;4;0;0;NA;5
441;Y_PNF_18;492;NA;NA;NA;NA;NA;NA;NA;NA;NA;NA;NA;NA;NA;NA;NA;NA;NA;NA;NA;NA;NA;NA;NA;NA;NA;NA;19;0;0;0;NA;Frio, brincar, amigos;3;0;0;NA;0;0;0;0;0;1;NA;1;2;3;0;2;3;NA;63;0;0;0;1;maîtresse, manger, jouer, chanter, parler, amis, cuisiner, bus;8;0;0;NA;Et après, à la fin, et(2);3;1;0;1;1;3;0;1;2;0;1;NA;11;;NA;41;0;0;0;1;Portugal, sitios, mar, praias, restaurante, x, circo, brincar, amigos, primos, primas, familia, divertir-se, férias;14;0;0;NA;0;0;1;0;1;1;3;0;0;2;1;1;4;NA;55;0;0;0;1;classe, park, jeux de société, s'amuser, glace, restaurant;6;0;0;NA;et à la fin, et après;2;1;0;1;2;3;2;1;4;0;0;NA;3;;NA;37;0;0;0;1;dia de férias, familia, restaurante, pizza, park, o tino, divertir-se;7;0;0;NA;0;0;1;2;3;1;3;0;1;2;0;0;1;NA;PNF;f;1;f1;1;487;NA;NA;NA;NA;NA;NA;NA;NA;NA;NA;NA;NA;NA;NA;NA;NA;NA;NA;NA;NA;NA;NA;19;0;0;0;0;0;0;1;0;1;0;1;0;1;0;1;0;0;0;NA;3;39;0;0;0;0;0;0;1;3;4;1;0;2;1;2;0;4;0;1;NA;1;NA;24;0;0;0;0;0;0;1;3;4;1;1;2;1;1;2;3;0;0;NA;3;28;0;0;0;0;0;0;1;3;4;1;0;1;1;1;2;3;0;0;NA;0;NA;53;0;0;0;1;0;1;1;3;4;2;1;2;1;0;2;2;0;0;NA;2
442;Y_PNF_19;493;NA;NA;NA;NA;NA;NA;NA;NA;NA;NA;NA;NA;NA;NA;NA;NA;NA;NA;NA;NA;NA;NA;NA;NA;NA;NA;9;0;0;0;1;Praia, familia, nadar, floresta, comer, casa;6;0;0;NA;e depois;1;1;0;1;2;2;0;0;2;0;0;0;NA;61;0;0;0;1;Course d'école, zoo, maîtresse, camarades, lions, singes, lapins, oiseaux, phtos, pique-nique, forêt, train, école;13;0;1;Ma dernière course d'école;et;1;1;0;2;3;3;0;2;2;2;1;NA;2;;NA;17;0;0;0;1;férias, praia, familia, mar, sol;5;0;1;últimas férias;0;0;1;0;2;1;2;0;2;2;0;0;0;NA;NA;NA;NA;NA;NA;NA;NA;NA;NA;NA;NA;NA;NA;NA;NA;NA;NA;NA;NA;NA;NA;NA;NA;NA;;NA;NA;NA;NA;NA;NA;NA;NA;NA;NA;NA;NA;NA;NA;NA;NA;NA;NA;NA;NA;NA;NA;NA;NA;NA;PNF;f;1;f1;1;83;NA;NA;NA;NA;NA;NA;NA;NA;NA;NA;NA;NA;NA;NA;NA;NA;NA;NA;NA;NA;NA;NA;125;0;0;0;1;0;1;1;3;4;0;1;3;3;0;0;2;0;0;NA;7;84;0;0;1;1;1;3;1;3;4;3;1;2;3;1;1;4;1;0;NA;6;NA;54;0;0;1;0;0;1;1;3;4;1;1;1;3;0;2;2;0;0;NA;0;NA;NA;NA;NA;NA;NA;NA;NA;NA;NA;NA;NA;NA;NA;NA;NA;NA;NA;NA;NA;NA;NA;NA;NA;NA;NA;NA;NA;NA;NA;NA;NA;NA;NA;NA;NA;NA;NA;NA;NA;NA;NA;NA
443;Y_PNF_2;494;62;0;0;0;1;Course d'école, bois du petit château, jouer, souris, maîtresse, boîte, trouver une boîte, enterrer, jouer;9;0;0;NA;et après ;1;1;0;1;2;2;0;2;2;2;0;NA;4;NA;NA;23;0;0;0;1;Praia. Carangueijo, nadar, algas, areia, pedras, balde;7;0;0;NA;0;0;1;0;1;1;2;0;2;2;0;0;4;NA;106;0;0;0;1;Course d'école, camp, tente, jouer, rhume des foins, boutons, feu, chanter, dormir;9;0;1;Ma dernière course d'école; Après (2), et (2), le soir, ensuite;4;1;0;2;3;2;1;2;4;1;0;NA;5;;NA;83;0;0;0;1;pais, sair, avós, sol, piscina, agua, quente, casa, comer, esperar, dormir, brincar, arrumar, pais, purê, batata, carne, irmãos, dormir;20;0;0;NA;de manhã, ao meio dia, 1h, depois (2), 1h30;5;1;2;3;3;2;2;2;4;0;0;0;NA;116;0;1;1;1;course d'école, chemin des statues, pause, amie, manger, garçons, tomber dans la boue, pleurer, train, parents;10;0;1;ma dernièrer course d'école;pour les 10 heures, pour midi, l'après-midi, après, et après (2), et (2);6;1;0;2;3;3;0;1;2;0;0;NA;2;;NA;110;0;0;0;1;Sabado, preparar-se. Acqua parc, carrinha, aberto, frio, mini calções, amigos, entrar, esperar, pais, bilhetes, piscina, brincar, nadar, comer, escorregas, óculos casa;18;0;0;NA;depois (5), um pouco, algum tempo;3;1;2;3;3;2;0;2;2;0;0;4;NA;PNF;f;1;f1;1;489;35;0;0;1;0;0;1;1;3;4;1;1;2;3;1;2;3;0;0;NA;3;NA;30;0;0;0;0;0;0;1;3;4;1;0;2;3;1;2;3;0;0;NA;0;60;0;0;1;1;1;3;1;3;4;3;1;3;3;1;2;4;0;0;NA;0;NA;52;0;0;1;1;1;3;1;3;4;3;1;2;3;2;2;4;0;0;NA;0;61;0;0;1;1;1;3;1;3;4;2;1;2;3;1;2;3;0;0;NA;0;NA;66;0;0;1;1;1;3;1;3;4;3;1;2;1;0;2;2;0;0;NA;0
444;Y_PNF_20;495;30;0;0;0;1;Catechisme, x, animaux, dictée, fiches;5;0;0;NA;NA;0;1;0;1;1;2;0;1;2;0;0;NA;4;NA;NA;19;0;0;0;1;Portugal, trotinete, surpresa;3;0;0;NA;0;0;1;0;1;1;2;2;2;1;0;0;3;NA;67;0;0;0;1;Grangeneuve, Fribourg, ferme, tracteur, cochons, lait, vâche, toucher la terre, agriculture, Musée de la marionnette;10;0;0;NA;et;1;1;0;1;1;2;0;0;2;0;0;NA;2;;NA;13;0;0;0;1;paris, disney, coisas, medo;4;0;0;NA;0;0;1;0;1;3;2;1;2;4;0;0;0;NA;47;0;0;0;1;estavayer-le-lac, une guide, jeux, grenouilles, opéra, école, chasse, dîner, petit trains;9;0;0;NA;NA;0;1;0;1;2;2;1;1;1;0;1;NA;0;;NA;44;0;0;0;1;dia, madeira, senhor, senhora, cãos, carro, pai, carte, touro, lago, fiche;11;0;0;NA;0;0;1;0;1;3;3;1;1;1;0;0;1;NA;PNF;f;1;f1;1;490;35;0;0;0;1;0;1;1;1;2;1;1;0;1;2;1;1;0;0;NA;4;NA;6;0;0;0;0;0;0;1;0;1;0;0;0;1;0;2;1;0;0;NA;0;23;0;0;1;1;0;2;1;1;2;0;1;2;1;2;2;3;0;0;NA;0;NA;23;0;0;1;0;0;1;1;1;2;2;1;2;1;1;2;4;0;0;NA;0;60;0;0;1;1;1;3;1;2;3;3;1;2;3;1;2;4;0;0;NA;1;NA;41;0;0;1;1;1;3;1;2;3;1;1;1;2;1;2;4;0;0;NA;5
445;Y_PNF_21;496;NA;NA;NA;NA;NA;NA;NA;NA;NA;NA;NA;NA;NA;NA;NA;NA;NA;NA;NA;NA;NA;NA;NA;NA;NA;NA;19;0;0;0;1;Banhos de charmey, amiga, tio, casa;4;0;0;NA;depois (2);1;1;0;1;1;2;0;0;2;0;0;3;NA;NA;NA;NA;NA;NA;NA;NA;NA;NA;NA;NA;NA;NA;NA;NA;NA;NA;NA;NA;NA;NA;NA;NA;NA;;NA;0;NA;NA;NA;NA;NA;NA;NA;NA;NA;NA;NA;NA;0;NA;NA;NA;NA;NA;NA;NA;NA;NA;présent mais rien écrit;NA;NA;NA;NA;NA;NA;NA;NA;NA;NA;NA;NA;NA;NA;NA;NA;NA;NA;NA;NA;NA;NA;NA;NA;;NA;NA;NA;NA;NA;NA;NA;NA;NA;NA;NA;NA;NA;NA;NA;NA;NA;NA;NA;NA;NA;NA;NA;NA;NA;PNF;f;1;f1;1;84;NA;NA;NA;NA;NA;NA;NA;NA;NA;NA;NA;NA;NA;NA;NA;NA;NA;NA;NA;NA;NA;NA;14;0;0;0;0;0;0;1;3;4;1;0;1;1;1;2;3;0;0;NA;5;NA;NA;NA;NA;NA;NA;NA;NA;NA;NA;NA;NA;NA;NA;NA;NA;NA;NA;NA;NA;NA;NA;0;0;0;0;0;0;0;0;0;0;0;0;0;0;0;0;0;0;0;NA;0;NA;NA;NA;NA;NA;NA;NA;NA;NA;NA;NA;NA;NA;NA;NA;NA;NA;NA;NA;NA;NA;NA;NA;NA;NA;NA;NA;NA;NA;NA;NA;NA;NA;NA;NA;NA;NA;NA;NA;NA;NA;NA;NA
446;Y_PNF_22;497;17;0;0;0;1;Copains, copines, tours, école;4;0;0;NA;NA;0;1;0;1;NA;1;0;0;2;0;2;NA;NA;NA;NA;11;0;0;0;1;avós, Portugal, suiça;3;0;0;NA;0;0;0;0;0;1;2;0;0;2;0;1;1;NA;81;0;0;0;1;date, 24 enfants, copins, copines, mamman, manger, boire, jouer, lego, voitures, ballon, x, y ;13;0;1;Le 9 mars 2012;et, après;2;1;0;2;0;2;1;2;1;0;3;NA;10;;NA;NA;NA;NA;NA;NA;NA;NA;NA;NA;NA;NA;NA;NA;NA;NA;NA;NA;NA;NA;NA;NA;NA;NA;NA;128;0;0;0;1;camping, grenouilles, mini-golf, banane, tante, manger, jouer, douche, gâteau, anniversaire, dormir, manger, parents, rentrer, s'endormir;15;0;0;NA;mardi, mercredi, en premier, deuxième, après (4), de x h jusqu'à 9h, et;7;1;0;1;2;3;1;2;4;2;1;NA;10;;NA;54;0;0;0;1;praia, peixe, pescar, x, senhor, dormir, ir, y, casa, dormir;10;0;0;NA;0;0;1;0;1;3;2;0;1;2;0;0;8;NA;PNF;f;1;f1;1;492;19;0;0;0;0;0;0;1;0;1;1;0;0;1;1;1;2;0;0;NA;1;NA;16;0;0;0;0;0;0;0;0;0;0;0;0;0;0;0;2;0;0;NA;0;51;0;0;1;1;0;2;1;2;3;1;1;1;1;0;2;3;0;1;NA;5;NA;NA;NA;NA;NA;NA;NA;NA;NA;NA;NA;NA;NA;NA;NA;NA;NA;NA;NA;NA;NA;NA;54;0;0;0;0;0;0;1;3;4;1;0;2;1;1;2;4;1;1;NA;1;NA;48;0;0;0;0;0;0;1;3;4;1;0;2;1;1;2;4;1;1;NA;5
447;Y_PNF_23;498;28;0;0;0;1;Course d'école, musée, voir, toucher, filme;5;0;NA;NA;NA;0;1;0;NA;1;1;1;2;3;0;4;NA;4;NA;NA;29;0;0;0;1;compras, ferias, yogurtes, bolos, rua, dia;6;0;0;NA;0;0;0;0;0;1;2;1;2;4;0;1;0;NA;52;0;0;0;1;course d'école, zoo, questions, loup, manger, parc, cache-cache, école;8;0;1;Dernière course d'école;Quand on a fini, et (2), finalement;3;1;0;2;1;2;1;2;4;0;1;NA;6;;NA;NA;NA;NA;NA;NA;NA;NA;NA;NA;NA;NA;NA;NA;NA;NA;NA;NA;NA;NA;NA;NA;NA;NA;NA;39;0;0;0;1;Ovronaz, classes, skier, maître de ski, apprendre, savoir skier;6;0;0;NA;au début, à la fin;2;1;0;1;2;2;1;2;3;0;0;NA;4;;NA;41;0;0;0;1;paris, pais, irmã, dormir, prima, tour eiffel, notre dame, louvre, casa, divertir-se;10;0;0;NA;depois ;1;1;0;1;1;3;1;1;4;0;0;0;NA;PNF;f;1;f1;1;493;28;0;0;1;1;0;2;1;1;2;3;1;1;1;1;2;3;0;0;NA;1;NA;27;0;0;1;1;0;2;1;2;3;3;1;2;1;1;2;1;0;0;NA;0;50;0;0;1;1;1;3;1;3;4;3;1;2;2;2;2;4;1;0;NA;5;NA;NA;NA;NA;NA;NA;NA;NA;NA;NA;NA;NA;NA;NA;NA;NA;NA;NA;NA;NA;NA;NA;32;0;0;0;0;0;0;1;3;4;1;1;1;2;1;2;1;2;1;NA;1;NA;29;0;0;0;0;0;0;1;3;4;1;1;1;2;1;2;4;0;0;NA;1
448;Y_PNF_24;499;NA;NA;NA;NA;NA;NA;NA;NA;NA;NA;NA;NA;NA;NA;NA;NA;NA;NA;NA;NA;NA;NA;NA;NA;NA;NA;45;0;0;0;1;primo, piscina, jogar, Ir;4;0;0;NA;passado uns tempos, já estava de noite, e depois;3;1;0;1;3;2;1;2;3;0;0;0;NA;59;0;0;0;1;classe, grenouille, jeux des antonymes, monter dans un arbre, tomber, école;6;0;0;NA;Le matin, après (2);2;1;0;1;3;3;0;2;2;1;0;NA;5;;NA;68;0;0;0;1;dia de férias, skate park, gland, dia, doente, hospital, oxigénio, médicos, ir, ficar, sorte, casa;12;0;0;NA;0;0;1;0;1;3;2;0;2;2;0;0;2;NA;123;1;0;1;1;course d'école, Palexpo, exposition, bus, gare, train, aéropot, attendre, fontaine de chocolat, gouter, passer la journée, chemin, classe, course d'école;14;1;1;ma dernière course d'école;à 9h du matin, et après, toute la journée;3;1;2;4;3;3;0;2;2;0;1;NA;3;;NA;NA;1;0;1;1;dia, pior, irmão, skate park, 50-50, medo, coragem, conseguir, filmar, falhar, pé, 4 semanas, andar, descobrir, dias, torcido, inchado, férias;17;0;0;NA;quando, 2 dias depois;2;1;NA;NA;3;3;0;2;3;0;0;1;NA;PNF;f;1;f1;1;494;NA;NA;NA;NA;NA;NA;NA;NA;NA;NA;NA;NA;NA;NA;NA;NA;NA;NA;NA;NA;NA;NA;35;0;0;0;0;0;0;1;3;4;1;0;2;1;2;2;4;0;1;NA;0;32;0;0;0;0;0;0;1;3;4;0;0;1;1;1;2;2;0;0;NA;1;NA;43;0;0;0;1;1;2;1;3;4;2;1;2;1;2;2;4;0;0;NA;0;50;0;0;1;1;0;2;1;3;4;2;1;2;2;1;2;4;0;0;NA;3;NA;59;0;0;1;1;0;2;1;3;4;3;1;3;3;1;2;4;0;0;NA;0
449;Y_PNF_25;500;80;0;0;0;1;Parcours vita, course d'école, mur, bâtons, barrage, cabane, bois;7;0;0;NA;et (4);1;1;0;1;3;2;1;1;4;0;2;NA;10;NA;NA;9;0;0;0;1;babyfoot, X, Portugal;3;0;0;NA;0;0;1;0;1;1;1;1;2;1;0;0;0;NA;100;0;0;0;1;Anniversaire, invités, jouer, chambre, équipe, jeu de construction;6;0;0;NA;Et après (2);1;1;0;1;3;2;0;2;2;0;1;NA;4;;NA;14;0;0;0;1;praia, jogar, areia, nadar;4;0;0;NA;0;0;1;0;1;3;2;0;2;2;0;0;3;NA;18;0;0;0;1;A la tour de X, Lac léman, villé;3;0;0;NA;NA;0;1;0;1;1;2;1;1;1;0;0;NA;0;;NA;15;0;0;0;1;férias, praia, tunéis, areia, estradas;5;0;0;NA;0;0;1;0;1;1;2;1;2;3;0;0;3;NA;PNF;f;1;f1;1;495;26;0;0;0;0;0;0;1;1;2;0;0;1;1;1;1;3;0;0;NA;2;NA;20;0;0;0;0;0;0;1;2;3;0;0;1;1;1;2;1;0;0;NA;8;49;0;0;0;0;0;0;1;3;4;1;0;2;1;0;2;4;0;0;NA;2;NA;19;0;0;0;0;0;0;1;2;3;0;0;1;1;0;2;3;0;3;NA;3;21;0;0;0;0;0;0;1;1;2;0;0;2;1;1;0;2;0;0;NA;1;NA;NA;0;0;0;0;0;NA;0;0;NA;0;0;0;0;0;0;0;0;0;NA;0
450;Y_PNF_26;501;NA;NA;NA;NA;NA;NA;NA;NA;NA;NA;NA;NA;NA;NA;NA;NA;NA;NA;NA;NA;NA;NA;NA;NA;NA;NA;17;0;0;0;1;piscina, jogos olimpicos, montanha, snowbord, frança;5;0;0;NA;0;0;1;0;1;1;2;0;0;2;0;1;4;NA;36;0;0;0;1;Chocolaterie Cailler, salle, préparation du chocolat, filme, acheter du chocolat, portes;6;0;0;NA;et (2);1;1;0;1;3;2;0;1;2;0;2;NA;6;;NA;17;0;0;0;1;férias, Portugal, casamento, madrinha, brincar;5;0;0;NA;e depois ;1;1;0;1;1;2;1;2;3;0;0;1;NA;59;0;0;0;1;camp de ski, amis, skier, groupe, pistes, concour, bonbons;7;0;0;NA;le dernier jour;1;1;0;1;3;3;1;1;3;2;5;NA;2;;NA;45;0;0;0;1;dia, piscina, amigos, pistolas, buracos, água, lago, melhor, barco, escorrega, gelados, golf, segundo;13;0;1;as ultimas férias;depois, e depois ;2;1;0;2;1;3;1;2;3;0;0;2;NA;PNF;f;1;f1;1;496;NA;NA;NA;NA;NA;NA;NA;NA;NA;NA;NA;NA;NA;NA;NA;NA;NA;NA;NA;NA;NA;NA;29;0;0;0;0;0;0;1;2;3;0;NA;1;1;0;1;2;0;1;NA;3;24;0;0;1;0;0;1;1;3;4;0;0;1;1;0;0;2;0;0;NA;4;NA;18;0;0;0;0;0;0;1;3;4;0;0;1;1;0;2;2;0;0;NA;1;51;0;0;0;0;0;0;1;3;4;1;0;2;1;1;1;4;0;0;NA;8;NA;30;0;0;0;1;0;1;1;3;4;2;1;1;1;1;2;4;0;0;NA;3
451;Y_PNF_27;502;29;0;0;0;1;Course d'école, La Sarraz, Romainmôtier, marcher, manger, pause;6;0;0;NA;NA;0;1;0;1;1;1;1;2;1;0;1;NA;3;NA;NA;19;0;0;0;1;Saint-tropez (frança), praia, casa, agua;4;0;0;NA;0;0;1;0;1;1;2;0;1;2;0;0;4;NA;NA;0;0;0;1;gare, train, manger, musée, boîte à musique, automates, danser, manger, marcher;9;0;0;NA;Puis (5), à la fin;2;1;NA;NA;3;2;0;0;2;1;1;NA;9;;NA;39;0;0;0;1;frança, casa, praia, fundo, pés, x, saint-tropez;7;0;0;NA;0;0;1;0;1;3;2;0;1;2;0;1;6;NA;132;0;0;0;1;gare, photos, partir, train, Vallorbe, changer de train, Morat, marcher, tour, montrer, continuer, diner, classe, marcher, bateau, manger, jouer, train, rentrer, parc, sac;21;0;0;NA;puis après, arpès, puis (4), et (11), 10 minutes, 40 minutes, pendant 1h;7;1;0;1;2;2;1;1;3;0;5;NA;14;;NA;46;0;0;0;1;Portugal, apartamento, praia, casa, piscine, gelado, restaurante, pais, café, irmão, comer;11;0;0;NA;durante, depois, e depois, e, a noite;5;1;0;1;1;3;0;0;2;0;0;2;NA;PNF;f;1;f1;1;497;24;0;0;0;0;0;0;1;3;4;1;0;1;1;1;2;3;0;0;NA;0;NA;10;0;0;0;0;0;0;1;3;4;0;0;1;1;1;2;1;0;0;NA;2;26;0;0;0;0;0;0;1;3;4;0;0;1;1;1;0;2;1;0;NA;1;NA;23;0;0;0;0;0;0;1;3;4;1;0;1;1;2;2;3;0;1;NA;3;27;0;0;0;0;0;0;1;3;4;1;0;2;1;1;1;3;0;0;NA;2;NA;20;0;0;0;0;0;0;1;3;4;1;0;1;1;1;2;3;0;0;NA;5
452;Y_PNF_28;503;4;NA;NA;NA;NA;NA;0;NA;NA;NA;NA;NA;0;0;NA;NA;NA;NA;NA;NA;NA;NA;NA;NA;NA;n'a pas voulu raconter;9;0;0;0;1;Piscina, braço;2;0;0;NA;0;0;1;0;1;1;2;1;2;3;0;0;0;NA;29;0;0;0;1;jouets, cadeaux, football, piscine;4;1;0;NA;Et après, et;2;0;0;0;2;3;1;1;1;0;0;NA;2;;NA;18;0;0;0;1;piscina, boling, mar, filme, meia noite;5;0;0;NA;até à meia noite;1;1;0;1;1;2;1;1;1;0;0;2;NA;36;0;0;0;1;course d'école, village lacustre, propulseurs, manger, école, rentrer, date;7;0;2;ma dernière course d'école, le 18 mai; et après, et (2);2;1;0;3;2;2;0;2;2;0;1;NA;0;;NA;25;0;0;0;1;ferias, Portugal, piscina, casa, café;5;0;1;últimas férias;de manhã, a seguir, a noite;3;1;0;2;1;2;0;2;2;0;0;0;NA;PNF;f;1;f1;1;498;14;0;0;0;0;0;0;1;1;2;1;0;1;1;1;0;3;0;0;NA;1;NA;36;0;0;0;1;1;2;1;3;4;1;NA;1;1;1;2;3;0;0;NA;0;33;0;0;0;1;0;1;1;3;4;1;0;2;1;1;2;4;0;0;NA;4;NA;18;0;0;0;0;0;0;1;3;4;1;0;1;1;1;2;3;0;0;NA;2;42;0;0;0;0;0;0;1;3;4;2;1;2;2;1;2;4;0;0;NA;2;NA;29;0;0;1;0;0;1;1;3;4;1;1;2;1;1;2;4;0;0;NA;0
453;Y_PNF_29;504;NA;NA;NA;NA;NA;NA;NA;NA;NA;NA;NA;NA;NA;NA;NA;NA;NA;NA;NA;NA;NA;NA;NA;NA;NA;NA;3;0;0;0;NA;X;1;0;0;NA;0;0;0;0;0;NA;NA;0;2;0;NA;NA;NA;NA;NA;1;0;1;1;Course d'école, piscine, forêt, cascade, hôpital, boire, se changer, linge, repas, se peigner, toboggan, manger, partir, ami;14;0;1;Vendredi 7.6.2012;Et après, et;2;1;NA;NA;1;2;0;1;2;1;1;NA;12;;NA;0;NA;NA;NA;NA;NA;NA;NA;NA;NA;NA;NA;NA;0;NA;NA;NA;NA;NA;NA;NA;NA;NA;a écrit en français;18;0;0;0;1;course d'école, piscine, revenir;3;0;0;NA;NA;0;1;0;1;1;2;0;0;1;1;0;NA;1;;NA;0;NA;NA;NA;NA;NA;NA;NA;NA;NA;NA;NA;NA;0;NA;NA;NA;NA;NA;NA;NA;NA;NA;NA;PNF;f;1;f1;1;499;NA;NA;NA;NA;NA;NA;NA;NA;NA;NA;NA;NA;NA;NA;NA;NA;NA;NA;NA;NA;NA;NA;12;0;0;0;0;0;0;1;1;2;0;0;1;1;1;2;2;1;0;NA;0;23;0;0;1;0;0;1;1;3;4;1;1;1;1;1;2;3;0;1;NA;4;NA;39;0;0;0;0;0;0;0;0;0;0;0;0;0;0;0;0;0;0;NA;0;18;0;0;0;0;0;0;1;3;4;0;0;2;1;0;0;1;0;0;NA;1;NA;NA;0;0;0;0;0;NA;0;0;NA;0;0;0;0;0;0;0;0;0;NA;0
454;Y_PNF_3;505;72;0;0;0;1;Course d'école, forêt, élèves, saucisse, manger, bus, rentrer;7;0;1;Dernière course d'école;après (2);1;1;0;2;0;3;0;1;2;4;2;NA;NA;NA;Impossible de repérer les verbes;35;0;0;0;1;Dia de férias, pai, mãe. Irmão, casa, passeio, dia;7;0;1;no ultimo dia de ferias ;de manha, a tarde;2;1;0;2;1;3;1;2;4;0;0;0;NA;197;0;0;0;1;Camp, gare, train, Neuchâtel, école, Musée naturel, pique-nique, parc de diversion, train, Budri, chalet, s'amuser, souper, soirée contes, lit, sortie, souper, disco, lit, musée, manger, piscine, bonbons, glace, train, Locle;26;0;0;NA;Le premier jour, et (5), ensuite (6), après (8), À la fin, le matin suivant, le jour suivant;7;1;0;1;3;3;0;1;3;3;1;NA;24;;1 mos en portugais (museu);100;0;0;0;1;pascoa, madrinha, pequeno almoço, brincar, primos, almoçar, familia, ovos, comer, coelhos, crianças, cantar, jantar, brincar, sobremesa, dansar, cantar, rir, contar, adorar, maximo;21;0;0;NA;logo de manhã, depois (4), no fim (2), às 16h, às 17.30h, às 20h00;6;1;0;1;1;3;0;2;2;0;0;0;NA;231;0;0;0;1;en camps, en velo, classe, gare du Lôcle, Emiboux, train, Chaux-de-Fonds, arriver, chalet, sacs, manger, piscine, manger, dormir, étang de la Gruyere, manger, animation, manger, dormir, chalet, chevaux, dessiner, course d'école, nettoyer, vélo, rentrer;26;0;1;marid 10 juin, mercredi 11 juin;8h30, 8h50, et (5), après (3), 6h30, mardi, mercredi, et après, l'après-midi, le lendemain, le matin, le vendredi;11;1;0;2;3;2;0;1;2;0;0;NA;3;;"""un peu plus loin du que les bois"" (du portugais!)";140;0;1;1;1;olá, revista, dia, férias, sol, acordar, primos, irmão, madrinha, padrinho, pais, avós, familia, praia, chegar, mesa, deitar, lugar, pão, pequeno almoço, mar, comer, brincar, nadar, lanchar, jantar, casa, dormir, dias de férias;29;1;0;NA;5h da manhã, as 7h da manhã, depois, às 8h da manhã, as 11h30, às 1h40, às 3h, às 19h, as24h55;9;1;2;3;3;2;0;1;2;0;1;4;NA;PNF;f;1;f1;1;500;27;0;0;0;1;0;1;1;3;4;2;1;2;1;1;1;3;0;2;NA;1;NA;49;0;0;1;1;0;2;1;3;4;3;1;1;3;2;2;4;0;1;NA;0;61;0;0;1;1;0;2;1;3;4;3;1;1;3;1;2;4;0;0;NA;4;NA;84;0;0;1;1;0;2;1;3;4;3;1;3;3;1;2;4;0;1;NA;1;115;0;0;1;1;1;3;1;2;3;0;1;3;2;0;2;2;0;0;NA;4;NA;89;0;1;1;1;1;4;1;3;4;3;1;1;3;0;1;2;0;1;NA;4
455;Y_PNF_30;506;30;0;0;0;1;Course d'école, forêt, parcours, jeux;4;0;0;NA;à la fin, et;2;1;0;1;1;1;0;2;2;1;2;NA;2;NA;NA;13;0;0;0;1;ferias, Portugal, piscina, primos;4;0;0;NA;0;0;1;0;1;1;2;0;0;1;1;0;1;NA;NA;NA;NA;NA;NA;NA;NA;NA;NA;NA;NA;NA;NA;NA;NA;NA;NA;NA;NA;NA;NA;NA;NA;NA;;NA;NA;NA;NA;NA;NA;NA;NA;NA;NA;NA;NA;NA;NA;NA;NA;NA;NA;NA;NA;NA;NA;NA;NA;NA;NA;NA;NA;NA;NA;NA;NA;NA;NA;NA;NA;NA;NA;NA;NA;NA;NA;NA;NA;NA;NA;NA;NA;NA;;NA;NA;NA;NA;NA;NA;NA;NA;NA;NA;NA;NA;NA;NA;NA;NA;NA;NA;NA;NA;NA;NA;NA;NA;NA;PNF;f;1;f1;1;85;23;0;0;0;1;1;2;1;3;4;2;0;1;1;1;2;3;0;0;NA;2;NA;22;0;0;0;1;1;2;1;2;3;2;0;2;1;1;2;3;0;0;NA;0;NA;NA;NA;NA;NA;NA;NA;NA;NA;NA;NA;NA;NA;NA;NA;NA;NA;NA;NA;NA;NA;NA;NA;NA;NA;NA;NA;NA;NA;NA;NA;NA;NA;NA;NA;NA;NA;NA;NA;NA;NA;NA;NA;NA;NA;NA;NA;NA;NA;NA;NA;NA;NA;NA;NA;NA;NA;NA;NA;NA;NA;NA;NA;NA;NA;NA;NA;NA;NA;NA;NA;NA;NA;NA;NA;NA;NA;NA;NA;NA;NA;NA;NA;NA;NA;NA
456;Y_PNF_31;507;26;0;0;0;1;Château, nuit, jouer, champ, magasin;5;0;0;NA;et;1;1;0;1;3;2;1;1;3;0;1;NA;2;NA;NA;NA;NA;NA;NA;NA;NA;NA;NA;NA;NA;NA;NA;NA;NA;NA;NA;NA;NA;NA;NA;NA;NA;NA;NA;21;0;1;1;1;Château, foot, manger, dormir;4;0;0;NA;NA;0;1;0;1;1;2;1;2;3;0;0;NA;3;;NA;31;0;0;0;1;mar, bronzear-se, volley-ball, areia, gelado, casa;6;0;0;NA;depois (4);1;1;0;1;1;2;1;2;3;0;0;7;NA;27;0;0;0;1;estavayer-le-lac, karaoké, moncicle, poterie;4;0;0;NA;en premier, en deuxième, en troisième;3;1;0;1;1;2;1;2;1;0;0;NA;1;;NA;54;0;0;0;1;verão, praia, nadar, gelados, bolachas, comer, toalha, jogar, pai, limpar-se, casa, jantar, banho, cama;14;0;0;NA;em primeiro, depois (3), e depois, e;4;1;0;1;1;2;1;2;4;0;0;11;NA;PNF;f;1;f1;1;502;16;0;0;0;0;0;0;1;3;4;0;0;1;1;1;2;1;0;0;NA;4;NA;NA;NA;NA;NA;NA;NA;NA;NA;NA;NA;NA;NA;NA;NA;NA;NA;NA;NA;NA;NA;NA;22;0;0;0;0;1;1;1;3;4;0;0;1;1;1;1;1;0;0;NA;3;NA;28;0;0;0;1;0;1;1;3;4;3;1;1;1;1;1;1;0;0;NA;0;48;0;0;0;0;0;0;1;3;4;1;1;1;2;1;1;4;0;0;NA;2;NA;32;0;0;1;0;0;1;1;3;4;2;1;1;1;1;2;1;0;0;NA;4
457;Y_PNF_32;508;28;0;0;0;1;Ferme, manger, jouer, partir;4;0;0;NA;après (2), et;2;1;0;1;1;2;1;2;1;0;2;NA;2;NA;NA;NA;NA;NA;NA;NA;NA;NA;NA;NA;NA;NA;NA;NA;NA;NA;NA;NA;NA;NA;NA;NA;NA;NA;NA;35;1;0;1;1;Journée de vacances, lunapark, maquillage, attractions, restaurant, cousins, x;7;0;0;NA;et;1;1;0;1;3;2;0;1;3;1;2;NA;5;;NA;36;0;0;0;1;manhã, pequeno-almoço, gelado, piscina, 3 metros, primas, x, jardim zoologico, comer, cama;11;0;0;NA;0;0;1;0;1;1;2;1;2;4;0;0;3;NA;27;0;0;0;1;valais, ski, apprendre, promenade, bon-homme de neige;5;0;0;NA;NA;0;1;0;1;1;2;1;1;3;0;0;NA;1;;NA;23;0;0;0;1;Portugal, praia, carangueijo, medo, correr, engraçado;6;0;0;NA;0;0;1;0;1;1;3;0;1;2;0;0;5;NA;PNF;f;1;f1;1;503;13;0;0;1;0;0;1;1;1;2;1;1;1;1;1;2;3;0;0;NA;3;NA;NA;NA;NA;NA;NA;NA;NA;NA;NA;NA;NA;NA;NA;NA;NA;NA;NA;NA;NA;NA;NA;35;0;1;1;1;1;4;1;3;4;3;1;2;3;1;2;4;0;2;NA;3;NA;21;0;0;0;0;1;1;1;3;4;3;1;1;1;1;2;4;0;0;NA;3;42;0;0;1;0;1;2;1;3;4;3;1;3;1;1;2;4;2;0;NA;1;NA;28;0;0;1;0;1;2;1;3;4;3;1;1;1;1;2;3;0;0;NA;5
458;Y_PNF_33;509;16;NA;NA;NA;NA;NA;NA;NA;NA;NA;NA;NA;NA;0;NA;NA;NA;NA;NA;NA;NA;NA;NA;NA;NA;Incompréhensible;44;0;0;0;1;ucraina, avós, primo, brincar, mar, passear, países, lembrar-se ;8;0;0;NA;0;0;1;0;1;3;3;2;2;4;0;0;0;NA;50;0;0;0;1;Course d'école, métro, train, musée, pièrre précieuse, foot, glace, monter une tour;8;0;1;Ma dernière course d'école;Après (2), tout l'après-midi;2;1;0;2;3;2;0;2;2;0;0;NA;6;;NA;20;0;0;0;1;férias, Portugal, praia, foot, divertido, engraçado, fixe;7;0;1;últimas férias;0;0;1;0;2;1;3;2;1;3;0;2;0;NA;82;0;0;0;1;Portugal, voitures anciennes, regarder, photo, jouer, musée, chemin, regarder, manger, revenir;10;0;0;NA;3h (durée), 8h du matin, 10h, jusqu'à une heure de l'après-midi, et;5;1;2;3;2;3;1;2;3;0;1;NA;5;;NA;22;0;0;0;1;paris, sexion d'assaut, fixe, torre, banda;5;0;0;NA;de manhã, a tarde;2;1;0;1;1;3;1;2;4;0;0;0;NA;PNF;f;1;f1;1;504;18;0;0;0;0;0;0;1;3;4;1;0;1;1;1;2;1;0;0;NA;1;NA;65;0;0;1;0;1;2;1;3;4;3;1;3;3;2;2;4;0;0;NA;2;60;0;0;1;0;0;1;1;3;4;2;1;3;1;1;2;3;0;0;NA;4;NA;44;0;0;1;0;0;1;1;3;4;2;1;2;3;2;2;3;0;0;NA;1;65;0;0;1;0;1;2;1;3;4;3;1;2;2;1;2;4;1;1;NA;2;NA;21;0;0;0;0;0;0;1;3;4;1;0;2;1;2;2;4;0;0;NA;0
459;Y_PNF_34;510;19;0;0;0;1;Yverdon, pique-nique, rentrer;3;0;0;NA;et après;1;1;0;1;1;2;0;2;2;0;0;NA;4;NA;NA;24;0;0;0;1;Portugal, praia, X, piscina, avó, casa;6;0;0;NA;e depois ;1;1;0;1;1;2;0;0;2;4;0;4;NA;45;0;0;0;1;Collège, lac, bateau, Musée, visitez, piscine, rentrer;7;0;0;NA;Et après (2), et;2;1;0;1;2;2;0;2;2;0;2;NA;4;;NA;16;0;0;0;1;Portugal, praia, jogar, amigos;4;0;0;NA;e depois ;1;1;0;1;1;2;0;1;2;0;0;3;une partie est incomprehensible ;91;0;0;0;1;camp de ski, bosse, tomber, aider, ami, se relever, manger, s'amuser, bataille de boulle de neige, snow-parc, sauts, crepes, la boum, dormir, rentrer;15;0;0;NA;après (3), à midi, et après (3, et (2), l'après-midi, le soir;6;1;0;1;3;2;1;1;3;0;6;NA;11;;NA;39;0;0;0;1;zoo, fiche, golfinhos, tartarugas, tubarões, piscina, montanha russa, escorregas, amigos, jogar, agua;11;0;0;NA;0;0;1;0;1;1;3;0;0;2;0;1;7;NA;PNF;f;1;f1;1;505;32;0;0;0;0;0;0;1;3;4;0;0;2;1;1;0;2;0;0;NA;5;NA;14;0;0;0;0;0;0;1;3;4;0;0;1;1;1;2;1;0;1;NA;4;18;0;0;0;0;0;0;1;1;2;1;0;2;1;1;2;3;0;1;NA;3;NA;17;0;0;0;0;0;0;1;3;4;0;0;2;1;1;2;2;0;0;NA;5;28;0;0;0;0;0;0;1;2;3;1;0;2;1;1;2;4;0;1;NA;4;NA;41;0;0;0;0;0;0;1;3;4;0;0;2;1;0;2;2;0;1;NA;4
460;Y_PNF_36;511;0;NA;NA;NA;NA;NA;NA;NA;NA;NA;NA;NA;NA;0;NA;NA;NA;NA;NA;NA;NA;NA;NA;NA;NA;NA;NA;NA;NA;NA;NA;NA;NA;NA;NA;NA;NA;NA;NA;NA;NA;NA;NA;NA;NA;NA;NA;NA;NA;NA;39;0;0;0;1;Bout du monde, course d'école, sport, les 400 m, lancer une balle;5;0;0;NA;NA;0;1;0;1;3;3;0;2;2;0;3;NA;4;;NA;28;0;0;0;1;"""vacances"", restaurante, barco, piscina, x, fiche";6;0;0;NA;e depois, depois, a noite;3;1;0;1;3;3;0;1;2;0;3;5;des parties incomprehensibles;57;0;1;1;1;camp, babyfoot, montagnes, marcher, une boum, show, danser;7;0;0;NA;pendant deux jours, le dernier jour, et;3;1;0;1;3;3;1;2;2;0;1;NA;1;;NA;30;0;1;1;1;camping, fiche, montanha, bum, dansar, bonito, raparigas;7;0;0;NA;0;0;1;0;1;3;3;0;1;2;0;1;6;NA;PNF;f;1;f1;1;506;40;0;0;0;0;0;0;1;3;4;0;0;2;3;1;0;2;0;0;NA;5;NA;NA;NA;NA;NA;NA;NA;NA;NA;NA;NA;NA;NA;NA;NA;0;0;0;NA;NA;NA;NA;53;0;0;1;0;1;2;1;3;4;3;1;2;1;0;2;3;0;2;NA;6;NA;NA;0;0;0;0;0;NA;1;0;NA;0;0;1;0;0;2;0;NA;NA;NA;NA;36;0;0;1;0;1;2;1;3;4;3;1;3;1;1;2;1;0;1;NA;1;NA;2;0;0;1;0;1;2;1;3;4;3;1;3;1;1;2;4;0;0;NA;6
