56;AD_PLF_18;60;23;0;1;1;1;Jouer au sac de patates, cache-cache, le goûter;3;0;0;NA;Et (2);1;0;0;0;1;1;1;1;2;0;0;NA;3;NA;NA;12;0;0;0;1;passeio, villa, mãe;3;0;0;NA;0;0;1;0;1;1;2;1;2;1;0;0;2;NA;45;0;0;0;1;Jouer, manger, lac, carte, trouver, x;6;0;0;NA;et (2);1;0;0;0;2;1;0;2;2;0;1;NA;NA;;Impossible de comprendre tous les verbes;23;0;0;0;1;brasil, madrinha, mar, casa, piscina, jogar;6;0;0;NA;todo o dia;1;1;0;1;3;2;0;2;2;0;0;2;NA;65;0;1;1;1;terrain de foot, jeux, cartes, pique-nique, bus, marcher, copains, beaucoup de choses;8;0;0;NA;après;1;1;0;1;1;3;0;2;2;0;3;NA;5;;NA;61;0;1;1;1;férias, Portugal, figueira da foz, mar, irmão, mãe, pai, madrinha, jogar, areia, comer, coisa verde, senhora, querer, pai, correr, dar;17;0;0;NA;de manhã;1;1;0;1;3;2;1;1;2;0;0;3;NA;PLF;f;1;f1;1;59;46;0;0;0;1;1;2;1;3;4;2;1;2;3;1;2;4;0;2;NA;4;NA;8;0;0;1;0;0;1;1;0;1;0;1;0;1;1;2;1;0;0;NA;2;42;0;0;1;0;0;1;1;3;4;2;1;2;3;1;2;4;0;1;NA;2;NA;39;0;0;1;1;0;2;1;3;4;1;1;1;2;1;2;3;0;0;NA;6;74;1;1;1;1;1;5;1;3;4;3;1;2;3;2;2;4;0;0;NA;3;NA;49;0;0;1;1;1;3;1;3;4;3;1;2;2;1;2;4;0;1;NA;1
57;AD_PLF_19;61;39;0;0;0;1;Piscine, mère, x, y, z, personnes;6;0;0;NA;NA;0;1;0;1;1;2;0;0;2;0;1;NA;3;NA;NA;0;NA;NA;NA;NA;NA;NA;NA;NA;NA;NA;NA;NA;0;NA;NA;NA;NA;NA;NA;NA;NA;NA;present mais rien écrit;19;0;0;0;1;x, vendre, 570 y;3;0;0;NA;Et après;1;0;0;0;1;1;0;0;2;0;0;NA;2;;NA;58;0;0;0;1;paris, torre eifel, policia, sair, dormir, passear, disneyland, familia, hotel, mãe, dormir;11;0;0;NA;às 11h, a seguir (2), 11h, mais uma vez (2);4;1;0;1;1;3;0;0;2;0;0;6;NA;23;0;0;0;1;Portugal, pêcher, faire du x;3;0;0;NA;le lendemain matin;1;1;0;1;1;2;0;0;2;0;0;NA;4;;NA;40;0;0;0;1;Portugal, férias, praia, pescar, pai, apanhar, casa, peixes, carangueijos;9;0;0;NA;quando;1;1;0;1;3;2;0;1;2;0;2;3;NA;PLF;f;1;f1;1;60;31;0;0;1;0;0;1;1;1;2;1;1;2;3;0;1;2;0;0;NA;6;NA;NA;0;0;0;0;0;NA;0;0;NA;0;0;0;0;0;0;0;0;0;NA;0;38;0;0;0;0;0;0;1;3;4;0;0;1;1;0;0;2;0;5;NA;3;NA;24;0;0;0;0;0;0;1;3;4;0;0;3;1;0;0;2;0;0;NA;2;25;0;0;0;0;0;0;1;3;4;1;0;1;1;0;0;2;0;1;NA;4;NA;16;0;0;0;0;0;0;1;3;4;1;0;1;1;1;2;3;0;0;NA;2
58;AD_PLF_2;62;35;0;0;0;1;Châteaux, x, visiter, y, jouer, frère;6;0;0;NA;Et après, et ;2;1;0;1;2;2;0;1;2;0;0;NA;7;NA;NA;12;0;0;0;1;piscina, X;2;0;0;NA;E depois;1;1;0;1;1;2;1;2;1;0;0;2;NA;3;0;0;0;1;en camp;1;0;0;NA;NA;0;1;0;1;1;1;0;0;0;0;0;NA;2;;NA;15;0;0;0;1;Portugal, nevar, sopa, x, frango;5;0;0;NA;0;0;1;0;1;1;2;0;1;2;0;0;2;NA;198;0;1;1;1;en camp, bagage, filles, garçons, salle de jeux, montagne, tomber, aider, pistes, cabane, manger, piste, tomber, le goûter, journée, jeux, douche, luge, loto, manger;20;0;0;NA;après (5), et après (2), et;3;1;0;1;3;2;0;1;2;3;7;NA;7;;NA;16;0;1;1;1;Portugal, novo ano, prendas, fixe;4;0;0;NA;0;0;1;0;1;3;3;1;1;3;0;0;0;NA;PLF;f;1;f1;1;61;49;0;0;1;0;1;2;1;3;4;3;1;1;3;0;2;2;0;1;NA;2;NA;16;0;0;0;0;0;0;1;2;3;0;0;1;1;0;2;2;0;0;NA;3;29;0;0;1;0;0;1;1;3;4;1;1;1;1;0;1;3;0;0;NA;1;NA;21;0;0;1;0;0;1;1;3;4;1;1;0;1;0;2;1;0;0;NA;3;59;0;1;1;0;0;2;1;3;4;3;1;3;3;0;1;2;0;0;NA;2;NA;44;0;1;1;0;1;3;1;3;4;3;1;2;1;1;2;3;0;0;NA;4
59;AD_PLF_20;63;34;0;0;0;1;Mère, Père, cousin, terrain de foot, jouer;5;0;0;NA;NA;0;1;0;1;1;2;0;2;2;0;0;NA;4;NA;"Possible  transfert du portugais : ""j'ai cansé"" = je me suis fatigué?";8;0;0;0;1;Portugal, praia;2;0;0;NA;0;0;1;0;1;1;2;1;0;1;0;0;1;NA;30;0;0;0;1;Meilleur ami, x nom, y;4;0;0;NA;NA;0;0;0;0;2;1;0;NA;2;1;0;NA;4;;NA;24;0;0;0;1;Portugal, revista, robôs, meter, melhor ;5;0;0;NA;e depois ;1;1;2;3;3;2;0;1;2;0;0;4;NA;46;0;0;0;1;salutation, course d'école, le cross, pic-nic, amis, jouer, école, salutation;8;1;1;ma dernière course d'école;et après, après;2;1;0;2;3;2;0;2;2;1;1;NA;7;;NA;21;0;0;0;1;Portugal, lisboa, benfica, jogar, ganhar;5;0;0;NA;0;0;1;0;1;1;2;0;1;2;0;0;0;NA;PLF;f;1;f1;1;62;28;0;0;0;0;0;0;1;0;1;0;0;1;3;0;1;2;0;0;NA;2;NA;6;0;0;0;0;0;0;1;0;1;0;0;0;1;1;0;1;0;0;NA;0;30;0;0;0;0;0;0;1;3;4;0;0;1;1;1;2;2;0;3;NA;3;NA;32;0;0;0;1;0;1;1;3;4;0;1;1;1;1;1;2;0;0;NA;2;36;0;0;1;1;1;3;1;3;4;0;1;2;1;0;2;2;1;1;NA;1;NA;22;0;0;1;0;0;1;1;3;4;2;1;1;1;1;2;3;0;0;NA;0
60;AD_PLF_21;64;NA;NA;NA;NA;NA;NA;NA;NA;NA;NA;NA;NA;NA;NA;NA;NA;NA;NA;NA;NA;NA;NA;NA;NA;NA;NA;63;0;0;0;1;piscina, prima, nadar, irmã, pai, avó, avô, brincar, comer, buscar, dormir;10;0;0;NA;depois de, outra vez;2;1;0;1;3;2;0;2;2;0;0;4;NA;64;0;0;0;1;Course d'école, spectacle, lapin emprisioné, revenir, jouer, père, aller;7;0;0;NA;Après (4), et (4);2;1;0;1;3;2;0;2;2;1;0;NA;8;;NA;94;0;0;0;1;Portugal, carro, comer, sol, avós, prima, piscina, fato de banho, comer, voltar, jogar, pai, avós, comer, pijama, cama, novela, dormir;18;0;0;NA;depois (3), e depois (2), até…;3;1;0;1;3;2;0;1;2;0;0;4;NA;122;0;1;1;1;Versoix, camp, chambres, valises, récréation, manger, personnes, ateliers, manger, jouer, parler, dormir;12;0;0;NA;en premier, après, et (2);3;1;0;1;2;2;1;2;3;1;3;NA;1;;NA;68;0;0;0;1;cruzeiro, comer, pai, barco, estádio do barcelona, irmão, mãe, barco, passeio, almoço, espetáculo, dormir, último dia.;14;0;0;NA;e (2);1;1;0;1;1;2;2;1;4;0;0;0;NA;PLF;f;1;f1;1;63;NA;NA;NA;NA;NA;NA;NA;NA;NA;NA;NA;NA;NA;NA;NA;NA;NA;NA;NA;NA;NA;NA;26;0;0;1;1;0;2;1;3;4;2;1;1;3;0;2;2;0;1;NA;0;48;0;0;1;1;1;3;1;3;4;2;1;3;3;0;2;2;0;6;NA;2;NA;38;0;0;1;1;0;2;1;3;4;2;1;2;3;1;2;3;1;0;NA;0;53;0;0;1;1;1;3;1;3;4;3;1;3;3;1;2;3;0;0;NA;2;NA;25;0;0;1;0;0;1;1;3;4;2;1;1;1;1;2;3;0;0;NA;0
61;AD_PLF_22;65;35;0;0;0;1;bois de la Bâtie, tomber, entorse au pied;3;0;0;NA;Et (2);1;1;0;1;2;2;0;0;2;1;0;NA;4;NA;NA;23;0;0;0;1;museu, papai, mamãe, irmã, restaurante;5;0;0;NA;e depois ;1;1;0;1;1;2;0;1;2;0;0;1;NA;32;0;0;0;1;Palexpo, chasse au trésor, x, peintre, dessiner, rigoler;5;0;0;NA;et (2);1;1;0;1;1;2;0;0;2;0;1;NA;6;;NA;28;0;0;0;1;ferias, piscina, amiga, cair, abelhas, comer, casa, rir;8;0;0;NA;e depois ;1;1;0;1;1;2;2;2;2;0;0;5;NA;39;0;0;0;1;course d'école, aller à la mer, pieds, se mouiller, animaux, journée;6;0;1;ma dernière course d'école;NA;0;1;0;2;2;2;0;2;2;1;1;NA;6;;NA;37;0;1;1;1;casa, piscina, saltar, jogar, comer, história;6;0;0;NA;no fim ;1;1;0;1;3;2;0;2;2;0;0;1;NA;PLF;f;1;f1;1;64;24;0;0;1;0;0;1;1;3;4;1;1;2;3;0;0;2;0;0;NA;3;NA;13;0;0;1;0;0;1;1;2;3;0;1;1;1;0;2;2;0;0;NA;2;17;0;0;1;0;0;1;1;2;3;0;0;1;1;1;2;3;0;0;NA;3;NA;20;0;0;1;0;0;1;1;2;3;1;0;2;1;0;1;1;0;0;NA;3;40;0;0;1;1;0;2;1;3;4;1;1;1;2;1;0;3;0;1;NA;0;NA;30;0;0;1;1;0;2;1;3;4;3;1;1;1;1;1;3;0;0;NA;3
62;AD_PLF_23;66;11;0;0;0;NA;gym, foot;2;0;NA;NA;NA;0;1;0;NA;1;NA;0;0;0;0;1;NA;1;NA;Il a écrit au futur;0;NA;NA;NA;NA;NA;NA;NA;NA;NA;NA;NA;NA;0;NA;NA;NA;NA;NA;NA;NA;NA;NA;present mais rien écrit;NA;NA;NA;NA;NA;NA;NA;NA;NA;NA;NA;NA;NA;NA;NA;NA;NA;NA;NA;NA;NA;NA;NA;NA;;NA;NA;NA;NA;NA;NA;NA;NA;NA;NA;NA;NA;NA;NA;NA;NA;NA;NA;NA;NA;NA;NA;NA;NA;NA;NA;NA;NA;NA;NA;NA;NA;NA;NA;NA;NA;NA;NA;NA;NA;NA;NA;NA;NA;NA;NA;NA;NA;NA;;NA;NA;NA;NA;NA;NA;NA;NA;NA;NA;NA;NA;NA;NA;NA;NA;NA;NA;NA;NA;NA;NA;NA;NA;NA;PLF;f;1;f1;1;11;34;0;0;0;0;0;0;1;3;4;0;0;1;1;0;0;0;0;4;NA;6;NA;17;0;0;0;0;0;0;1;0;1;0;0;2;1;0;1;2;2;2;NA;4;NA;NA;NA;NA;NA;NA;NA;NA;NA;NA;NA;NA;NA;NA;NA;NA;NA;NA;NA;NA;NA;NA;NA;NA;NA;NA;NA;NA;NA;NA;NA;NA;NA;NA;NA;NA;NA;NA;NA;NA;NA;NA;NA;NA;NA;NA;NA;NA;NA;NA;NA;NA;NA;NA;NA;NA;NA;NA;NA;NA;NA;NA;NA;NA;NA;NA;NA;NA;NA;NA;NA;NA;NA;NA;NA;NA;NA;NA;NA;NA;NA;NA;NA;NA;NA;NA
63;AD_PLF_24;67;35;0;0;0;1;Piscine, ferme, poney, eau, gourde;5;0;0;NA;Alors, et;2;1;0;1;3;2;1;1;4;0;0;NA;1;NA;NA;16;0;0;0;1; Portugal, piscina;2;0;0;NA;0;0;1;0;1;1;1;0;0;1;0;0;0;NA;13;0;0;0;1;stade, compétition;2;0;0;NA;NA;0;1;0;1;1;1;0;1;1;0;0;NA;0;;NA;16;0;0;0;1;Portugal, praia, horas;3;0;0;NA;das 8h até 20h;1;1;0;1;1;2;1;1;1;0;0;2;"influences du francês: ""a Portugal"", ""des de 8h até…"" (depuis) alors qu'il fallait mettre ""das"".";61;0;0;0;1;maison de la x, jeux, cabanes, faire une cabane, base militaire, personnes, chambre, jeux, kebak;9;0;0;NA;NA;0;1;0;1;2;2;2;2;3;0;3;NA;2;;NA;34;0;0;0;1;floresta, Portugal, casa, árvores, grande, dia, avião, suiça;8;0;0;NA;até ao fim, depois;2;1;0;1;1;2;0;1;3;0;0;1;NA;PLF;f;1;f1;1;66;47;0;0;0;0;0;0;1;3;4;0;0;0;1;2;1;1;0;4;NA;1;NA;38;0;0;0;0;0;0;1;3;4;1;0;1;1;1;1;4;0;0;NA;2;26;0;0;0;0;0;0;1;3;4;1;0;1;1;2;2;3;0;0;NA;1;NA;16;0;0;0;0;0;0;1;3;4;1;0;1;1;1;1;1;0;0;NA;3;44;0;0;1;0;0;1;1;3;4;1;0;1;1;1;2;4;0;2;NA;3;NA;64;0;0;0;1;0;1;1;3;4;2;1;2;2;2;2;4;0;0;NA;2
64;AD_PLF_25;68;33;0;0;0;1;Sortie d'école, théâtre, ogres, Sophie, parents;5;0;1;Ma dernière sortie d'école;NA;0;1;0;2;2;3;1;1;3;3;2;NA;3;NA;NA;20;0;0;0;1;ferias, praia, primo, água, areia;5;0;0;NA;0;0;1;0;1;1;2;1;2;3;0;2;2;NA;29;0;0;0;1;Le bon gros géant, une fille, 7 géants, on petit géant, une présentatrice, un présentateur;6;0;0;NA;NA;0;0;0;0;3;1;1;2;3;0;1;NA;3;;NA;10;0;0;0;1;praia, brincar, agua, areia;4;0;0;NA;0;0;1;0;1;1;2;1;0;3;0;0;2;NA;59;0;1;1;1;course d'école, musée, pique-nique, rigoler, s'intéresser, temps, rentrer, jouer;8;0;1;ma dernière course d'école;quand nous sommes rentrés;1;1;0;2;2;3;1;2;4;1;3;NA;3;;NA;56;0;1;1;1;leitores, dia de férias, itália, familia, sol, hotel, passeio, museus, submarino, água, parado, gelado;12;1;1;o meu último dia de férias;e depois, depois;2;1;0;2;3;2;1;2;4;0;0;0;NA;PLF;f;1;f1;1;67;47;0;0;0;0;0;0;1;3;4;1;0;2;1;1;2;3;1;0;NA;8;NA;18;0;0;0;0;0;0;1;2;3;0;0;2;1;0;2;2;0;0;NA;1;36;0;0;1;1;1;3;1;3;4;3;1;2;1;1;2;4;0;3;NA;5;NA;19;0;0;1;0;0;1;1;3;4;1;1;1;3;1;1;3;0;0;NA;4;87;0;0;1;1;1;3;1;3;4;3;1;3;2;2;2;4;1;0;NA;0;NA;47;0;0;1;1;1;3;1;3;4;3;1;2;1;1;2;4;0;0;NA;0
65;AD_PLF_26;69;36;0;0;0;1;Course d'école, foot, Manger, sauter, viser, attraper, glisser, tirer;8;0;0;NA;NA;0;0;0;0;2;3;2;2;3;0;4;NA;4;NA;NA;28;0;0;0;1;ferias, carro, prima, aparecer;4;0;1;As férias de 2012;0;0;0;0;1;3;3;1;1;2;0;1;3;NA;58;0;0;0;1;Course d'école, tour du préau, trois classes, filles, garçon, Dijane, moi, médaille;8;0;0;NA;NA;0;1;0;1;3;2;1;2;4;0;0;NA;0;;NA;13;0;0;0;1;5 anos, irmão, brincar;3;0;1;quando eu tinha 5 anos;0;0;0;0;1;3;1;0;NA;2;0;0;1;NA;50;0;0;0;1;partir, montagne, jeux, foot, basket, cartes;6;0;0;NA;le matin, à midi, après, à la fin;4;1;0;1;3;2;2;2;4;1;3;NA;4;;NA;56;0;0;0;1;acordar, lavar os dentes, vestir-se, estudar, televisão, brincar, dia, almoço, Wii, brincar, rua, amigos, jantar, televisão, dormir;15;0;0;NA;depois (5), outra vez, mais tarde, e;4;1;0;1;1;2;0;2;2;0;0;16;NA;PLF;f;1;f1;1;68;30;0;0;1;0;0;1;1;2;3;0;1;0;1;1;2;3;0;1;NA;4;NA;27;0;0;1;0;0;1;1;3;4;0;1;2;1;1;2;1;0;0;NA;3;31;0;0;0;0;0;0;1;3;4;1;1;0;3;2;2;4;0;0;NA;1;NA;22;0;0;0;0;0;0;1;3;4;0;0;0;3;1;2;1;0;0;NA;1;80;0;0;1;1;1;3;1;3;4;3;1;3;2;1;2;4;1;6;NA;6;NA;39;0;0;1;1;0;2;1;2;3;3;1;1;2;1;2;4;0;0;NA;2
66;AD_PLF_27;70;NA;NA;NA;NA;NA;NA;NA;NA;NA;NA;NA;NA;NA;NA;NA;NA;NA;NA;NA;NA;NA;NA;NA;NA;NA;NA;NA;NA;NA;NA;NA;NA;NA;NA;NA;NA;NA;NA;NA;NA;NA;NA;NA;NA;NA;NA;NA;NA;NA;NA;NA;NA;NA;NA;NA;NA;NA;NA;NA;NA;NA;NA;NA;NA;NA;NA;NA;NA;NA;NA;NA;NA;NA;NA;;NA;28;0;0;0;1;Portugal, algarve, piscina, nadar, praia, castelo, cavalo;7;0;0;NA;depois, e depois ;2;1;0;1;1;2;0;1;4;0;0;4;NA;NA;NA;NA;NA;NA;NA;NA;NA;NA;NA;NA;NA;NA;NA;NA;NA;NA;NA;NA;NA;NA;NA;NA;NA;;NA;NA;NA;NA;NA;NA;NA;NA;NA;NA;NA;NA;NA;NA;NA;NA;NA;NA;NA;NA;NA;NA;NA;NA;NA;PLF;f;1;f1;1;69;NA;NA;NA;NA;NA;NA;NA;NA;NA;NA;NA;NA;NA;NA;NA;NA;NA;NA;NA;NA;NA;NA;NA;NA;NA;NA;NA;NA;NA;NA;NA;NA;NA;NA;NA;NA;NA;NA;NA;NA;NA;NA;NA;NA;NA;NA;NA;NA;NA;NA;NA;NA;NA;NA;NA;NA;NA;NA;NA;NA;NA;NA;NA;NA;NA;13;0;0;1;0;0;1;1;1;2;2;1;1;3;1;2;3;0;0;NA;0;46;0;1;1;0;1;3;1;3;4;3;0;1;2;1;2;4;0;0;NA;3;NA;NA;NA;NA;NA;NA;NA;NA;NA;NA;NA;NA;NA;NA;NA;NA;NA;NA;NA;NA;NA;NA
67;AD_PLF_28;71;NA;NA;NA;NA;NA;NA;NA;NA;NA;NA;NA;NA;NA;NA;NA;NA;NA;NA;NA;NA;NA;NA;NA;NA;NA;NA;NA;NA;NA;NA;NA;NA;NA;NA;NA;NA;NA;NA;NA;NA;NA;NA;NA;NA;NA;NA;NA;NA;NA;NA;NA;NA;NA;NA;NA;NA;NA;NA;NA;NA;NA;NA;NA;NA;NA;NA;NA;NA;NA;NA;NA;NA;NA;NA;;NA;NA;NA;NA;NA;NA;NA;NA;NA;NA;NA;NA;NA;NA;NA;NA;NA;NA;NA;NA;NA;NA;NA;NA;NA;132;0;1;1;1;lecteur et lectrice, camp, s'amuser, Mauge, classe, jeux, jour, tenis, vtt, piscine, jouer, boisson, la boum, garçons, filles, venir, vendredi, école, manger, au revoir;20;1;0;NA;le premier jour, le soir, à 22h, vendredi, 4h00;5;1;0;1;3;3;1;2;3;2;3;NA;12;;NA;100;0;1;1;1;olá, nome, idade, férias, Portugal, familia, aeroporto, excitada, terra, pais, avô, avó, primos, mãe, tio, tia, avó, avô, data, natal, prenda, acordar, fazer o natal, data, suiça;25;1;2;25 de dezembro de 2013, 08 de janeiro de 2014;depois (2), logo que;2;1;0;3;3;2;1;2;4;0;2;1;NA;PLF;f;1;f1;1;70;NA;NA;NA;NA;NA;NA;NA;NA;NA;NA;NA;NA;NA;NA;0;0;0;NA;NA;NA;NA;NA;NA;NA;NA;NA;NA;NA;NA;NA;NA;NA;NA;NA;NA;NA;0;0;0;NA;NA;NA;NA;NA;NA;NA;NA;NA;NA;NA;NA;NA;NA;NA;NA;NA;NA;0;0;0;NA;NA;NA;NA;NA;NA;NA;NA;NA;NA;NA;NA;NA;NA;NA;NA;NA;NA;NA;0;0;0;NA;NA;NA;NA;NA;NA;NA;NA;NA;NA;NA;NA;NA;NA;NA;NA;NA;NA;NA;NA;NA;NA;NA;NA;NA;NA;41;0;0;1;0;0;1;1;3;4;3;1;1;1;2;2;4;0;0;NA;2
68;AD_PLF_3;72;8;0;0;0;1;Magasin, mère;2;0;0;NA;NA;0;1;0;1;1;1;1;0;1;0;0;NA;1;NA;NA;0;NA;NA;NA;NA;NA;NA;NA;NA;NA;NA;NA;NA;0;NA;NA;NA;NA;NA;NA;NA;NA;NA;present mais rien écrit ;8;0;0;0;1; os de dinosaure;1;0;0;NA;NA;0;0;0;0;1;1;0;0;0;0;1;NA;2;;NA;3;0;0;0;1;ferias;1;0;0;NA;0;0;0;0;0;1;1;1;0;1;0;0;0;NA;NA;NA;NA;NA;NA;NA;NA;NA;NA;NA;NA;NA;NA;NA;NA;NA;NA;NA;NA;NA;NA;NA;NA;NA;;NA;NA;NA;NA;NA;NA;NA;NA;NA;NA;NA;NA;NA;NA;NA;NA;NA;NA;NA;NA;NA;NA;NA;NA;NA;PLF;f;1;f1;1;12;12;0;0;0;0;0;0;1;1;2;0;0;0;3;1;0;2;1;0;NA;2;NA;8;0;0;0;0;0;0;0;0;0;0;0;0;1;0;1;2;0;0;NA;1;14;0;0;0;0;0;0;1;1;2;0;0;0;1;1;NA;1;0;0;NA;2;NA;8;0;0;0;0;0;0;0;0;0;0;0;0;1;0;1;2;0;0;NA;2;NA;NA;NA;NA;NA;NA;NA;NA;NA;NA;NA;NA;NA;NA;NA;NA;NA;NA;NA;NA;NA;NA;NA;NA;NA;NA;NA;NA;NA;NA;NA;NA;NA;NA;NA;NA;NA;NA;NA;NA;NA;NA;NA
69;AD_PLF_4;73;40;0;0;0;1;Courir, crêpes, sauter à la corde, bowling, jouer à cache-cache, maison;6;0;0;NA;Et (2), et après (2);2;0;0;0;1;1;0;2;2;0;0;NA;8;NA;NA;16;0;0;0;1;praia, água;2;0;0;NA;0;0;1;0;1;3;0;0;2;2;0;0;1;NA;28;0;0;0;1;parc, jouer au loup, manger, nager, se bronzer;5;0;0;NA;à midi, après;2;1;0;1;1;1;0;NA;2;0;0;NA;5;;NA;36;0;0;0;1;praia, brincar, primos, café, leite, nadar, castelo, primos, sol, gelado;10;0;0;NA;e depois (2);1;1;0;1;3;2;0;2;2;0;0;2;NA;136;0;0;0;1;en camp, groupe, VTT, ski, changer, cacher-cacher, personnes, trampolin, tir à l'arc, accro-branche, cabane, labyrinthe, manger;13;0;0;NA;le premier jour, le deuxième jour, le troisième jour, après, en dernier, le quatrième jour, à midi, pendant la nuit;8;1;0;1;2;3;0;2;2;2;2;NA;6;;NA;121;0;0;0;1;ferias, Portugal, familia, avós, tia, primos, praia, dia, chegar, frio, habituar-se, calor, café, gelados, tia, filhos, jogar, sol, água, fria, ir embora;21;0;0;NA;de manhã, passado um tempo, a tarde. Enquanto, às 4 horas, às 8 horas;6;1;2;3;3;3;0;2;2;0;0;0;NA;PLF;f;1;f1;1;72;25;0;0;0;0;0;0;1;3;4;1;0;1;1;1;2;3;0;1;NA;0;NA;24;0;0;0;0;0;0;1;3;4;0;0;1;1;0;2;2;0;0;NA;0;26;0;0;0;0;0;0;1;3;4;1;0;1;1;1;2;4;0;0;NA;0;NA;24;0;0;0;0;0;0;1;3;4;1;0;1;1;0;2;1;0;1;NA;0;48;0;0;0;1;1;2;1;3;4;3;1;2;1;1;2;4;0;2;NA;0;NA;39;0;0;0;0;0;0;1;3;4;0;0;2;3;0;1;2;0;0;NA;1
70;AD_PLF_6;75;92;0;0;0;1;Châteaux, chocolat, choisir, visite, pièce, labyrinthe, Se perdre, retrouver, pique-nique, jouer, s'amuser, rentrer;12;0;0;NA;Puis, Après (3), et (2);3;1;0;1;3;3;0;0;2;0;0;NA;6;NA;NA;15;0;0;0;1;mar, ondas, primas, erriçar;4;0;0;NA;0;0;1;0;1;3;0;0;0;2;0;0;2;NA;40;0;0;0;1;grottes de Vallorbe, pièrres, tomber, spectacle, pièrres précieuses;5;0;0;NA;et, ensuite;2;1;0;1;3;2;0;1;2;1;6;NA;3;;NA;24;0;0;0;1;mar, gelado, brincar, tia, casa;5;0;0;NA;depois, e depois;2;1;0;1;1;2;0;2;2;0;0;1;NA;34;0;1;1;1;grottes de Vallorbe, Pierres, couleur des pierres;3;0;0;NA;NA;0;0;0;0;2;3;1;2;3;0;0;NA;1;;NA;54;0;0;0;1;santarém, casa, praia, nadar, comprar, água, estrela do mar, mãe, mostrar, cossegas,água;11;0;0;NA;depois (2);1;1;0;1;3;2;0;2;2;0;0;3;NA;PLF;f;1;f1;1;74;23;0;0;0;0;0;0;1;2;3;1;0;1;1;0;0;2;0;5;NA;3;NA;32;0;0;0;0;0;0;1;0;1;0;1;0;1;0;1;2;0;0;NA;3;29;0;0;0;0;1;1;1;2;3;1;0;1;1;1;1;1;0;0;NA;3;NA;17;0;0;0;0;0;0;1;2;3;0;0;1;1;1;2;3;0;0;NA;1;49;0;0;0;0;0;0;1;3;4;0;0;2;1;0;2;2;0;1;NA;2;NA;57;0;0;0;0;0;0;1;3;4;0;0;1;1;0;2;2;0;0;NA;5
71;AD_PLF_7;76;9;0;0;0;1;x, classe;2;0;0;NA;NA;0;0;0;0;1;1;1;2;1;0;0;NA;1;NA;NA;0;NA;NA;NA;NA;NA;NA;NA;NA;NA;NA;NA;NA;0;NA;NA;NA;NA;NA;NA;NA;NA;NA;present mais rien écrit;4;0;0;0;0;NA;0;0;0;NA;NA;0;0;0;0;1;NA;0;0;1;0;0;NA;0;;"""Je ne me rappelle plus""";6;0;0;0;1;casa, amiga;2;0;0;NA;0;0;1;0;1;1;1;1;0;1;0;0;1;NA;NA;NA;NA;NA;NA;NA;NA;NA;NA;NA;NA;NA;NA;NA;NA;NA;NA;NA;NA;NA;NA;NA;NA;NA;;NA;NA;NA;NA;NA;NA;NA;NA;NA;NA;NA;NA;NA;NA;NA;NA;NA;NA;NA;NA;NA;NA;NA;NA;NA;PLF;f;1;f1;1;13;16;0;0;0;0;0;0;1;2;3;0;0;3;1;0;2;2;0;0;NA;1;NA;17;0;0;0;0;0;0;1;2;3;1;0;1;1;1;2;1;0;0;NA;3;23;0;0;0;0;0;0;1;3;4;1;0;2;1;1;2;3;0;0;NA;5;NA;22;0;0;0;0;0;0;1;1;2;0;0;1;3;1;2;2;0;0;NA;1;NA;NA;NA;NA;NA;NA;NA;NA;NA;NA;NA;NA;NA;NA;NA;NA;NA;NA;NA;NA;NA;NA;NA;NA;NA;NA;NA;NA;NA;NA;NA;NA;NA;NA;NA;NA;NA;NA;NA;NA;NA;NA;NA
72;AD_PLF_8;77;37;0;0;0;1;Piscine, zoo, x, rentrer, la course d'école, zoo;6;0;0;NA;Après, ensuite, pour finir;3;1;0;1;1;1;2;0;3;0;0;NA;6;NA;NA;20;0;0;0;1;Portugal, piscina, avó, brincar;4;0;0;NA;0;0;1;0;1;1;2;0;1;2;0;0;1;NA;26;0;0;0;1;Salon du livre, pleuvoir, Chasse au trésor, livres;4;0;0;NA;NA;0;1;0;1;3;2;0;0;2;0;0;NA;2;;NA;22;0;0;0;1;pascoa, Portugal, vestido, batizado, praia, jogar;6;0;0;NA;0;0;1;0;1;3;2;0;1;2;0;0;2;NA;NA;0;0;0;1;course d'école, camp, boum, jeux, VTT, ski, jouer, ferme, promenades, cache-cache, rentrer, se passer, aimer;13;0;1;ma dernière course d'école;le dernier jour, et;2;1;NA;NA;3;3;0;1;2;0;5;NA;4;;NA;60;0;0;0;1;Portugal, noite, avô, piscina, acordar, fato de banho, mergulhar, comer, jogar, pescar, irmã, primos, férias;14;0;0;NA;noite, e depois, depois (2);3;1;0;1;3;3;0;1;2;0;0;5;NA;PLF;f;1;f1;1;76;17;0;0;0;0;0;0;1;1;2;1;0;1;3;0;2;3;0;0;NA;1;NA;26;0;0;0;1;0;1;1;3;4;0;1;2;1;0;2;2;0;0;NA;5;28;0;0;0;0;0;0;1;3;4;1;1;1;3;0;1;3;0;0;NA;1;NA;30;0;0;1;0;0;1;1;3;4;1;1;1;1;1;1;1;0;0;NA;3;56;0;0;1;1;1;3;1;3;4;3;1;2;3;2;2;4;0;0;NA;3;NA;55;0;0;1;0;1;2;1;3;4;3;1;2;2;2;1;2;0;0;NA;2
73;AD_PLF_9;78;59;0;0;0;1;Dinosaure, travail, portrait, forêt, manger, promenade, école;7;0;0;NA;Et (4), ensuite (3);2;1;0;1;2;2;0;2;2;1;1;NA;3;NA;NA;0;NA;NA;NA;NA;NA;NA;NA;NA;NA;NA;NA;NA;0;NA;NA;NA;NA;NA;NA;NA;NA;NA;present mais rien écrit;42;0;0;0;1;Dinosaures, travail, nom du dinosaure, diplôme, forêt;5;0;0;NA;et à la fin, et;2;0;0;0;1;2;0;0;2;0;2;NA;6;;NA;31;0;0;0;1;coimbra, brincar, primos, comer, avós, x, piscina, praia;8;0;0;NA;depois, e depois;2;1;0;1;1;2;0;2;2;0;0;4;NA;68;0;0;0;1;en camp, lac, théâtre, comédie musicale, musique, masque, poterie, chambre, filles, se promener, s'amuser;11;0;0;NA;le soir;1;1;0;1;2;3;2;2;3;1;1;NA;2;;NA;78;0;0;0;1;férias, algarve, gostar, zoomarine, golfinhos, espetãculos, cinema, chamar-se, filme, agua, molhados, carosséis, piscinas, lembrança, ir embora;15;0;1;as minhas últimas férias;depois, e depois, e;3;1;2;4;3;3;0;2;2;0;0;0;NA;PLF;f;1;f1;1;77;56;0;0;0;0;0;0;1;3;4;1;0;2;1;2;2;2;0;3;NA;1;NA;6;0;0;0;0;0;0;1;0;1;0;0;0;1;0;2;1;0;0;NA;0;36;0;0;0;0;0;0;1;3;4;0;0;2;1;0;2;2;0;0;NA;4;NA;58;0;0;0;0;0;0;1;3;4;0;0;2;3;0;2;2;0;0;NA;1;NA;1;1;1;1;1;NA;1;3;NA;2;1;2;2;0;2;2;0;1;NA;3;NA;79;0;0;0;0;0;0;1;3;4;1;1;2;3;0;1;3;0;0;NA;2
74;AE_PLF_1;79;37;0;0;0;1;Bus, X, Y, manger Y, arbres;5;0;0;NA;et (2), et après;2;1;0;1;1;2;0;0;2;0;2;NA;5;NA;NA;6;0;0;0;1;piscina, matrimónio, Portugal ;3;0;0;NA;0;0;1;0;1;NA;1;0;0;0;0;0;0;3 propositions en FR;37;0;0;0;1;Europapark, jeux, X, toboggan, Z, pédales;6;0;0;NA;et (4), aussi;2;1;2;3;3;2;0;0;2;1;0;NA;3;;NA;16;0;0;0;1;piscina, bronzear, água, amigos;4;0;0;0;NA;0;1;0;1;1;1;0;0;2;1;0;2;NA;90;0;0;0;0;anniversaire, personnes, jouer, dessiner, jeu, gâteau, cadeaux, bonbons, partir;9;0;0;NA;et, et après (7), encore (2);3;0;0;0;3;1;0;2;2;0;2;NA;12;;"""j'ai ouvirs"" (j'ai ouvert): du portugais: ""eu abri""";16;0;0;0;1;casa, comer, jogar, jardim, piscina;5;0;0;NA;0;0;1;0;1;1;2;0;0;2;0;0;0;NA;PLF;f;1;f1;1;78;29;0;0;0;0;0;0;1;3;4;1;0;1;1;1;0;2;0;0;NA;4;NA;21;0;0;1;0;0;1;1;3;4;1;1;1;1;0;0;2;0;1;NA;3;17;0;0;0;0;0;0;1;3;4;0;0;1;1;0;0;1;0;1;NA;1;NA;10;0;0;0;0;0;0;1;3;4;0;0;0;1;0;0;2;0;0;NA;3;58;0;0;0;0;0;0;1;3;4;0;0;2;2;0;2;2;0;2;NA;0;NA;25;0;0;0;0;0;0;1;3;4;0;0;1;1;0;0;2;0;0;NA;2
75;AE_PLF_2;80;0;NA;NA;NA;NA;NA;NA;NA;NA;NA;NA;NA;NA;0;NA;NA;NA;NA;NA;NA;NA;NA;NA;NA;NA;NA;30;0;0;0;1;avó, comer, prenda, ir embora;4;0;0;NA;ao meio dia, em (3);2;1;0;1;1;2;0;0;2;0;0;3;NA;36;0;0;0;1;Palois de congrès, répéter, grand concert, 400 (personnes), rentrer;5;0;0;NA;et 30min après, et;2;1;0;1;1;2;0;2;2;1;2;NA;4;;NA;42;0;0;0;1;mar, França, St. Tropez, bicicleta, pic-nic, amigas, dia, dormir;8;0;0;0;às 9h50;1;1;0;1;1;2;0;0;2;0;0;1;NA;39;0;0;0;1;course d'ecole, debat philosophique, classes françaises, pique-niquer, foret, danse;6;0;1;la derniere fois;et, a la fin;2;1;0;2;1;2;0;2;2;2;2;NA;3;;NA;48;0;0;0;1;lyon, frança, giro, aquario, grande, dia, park, volta, bicicleta, lugares, gostar;11;0;0;NA;2 horas;1;1;0;1;3;3;0;1;2;0;0;3;NA;PLF;f;1;f1;1;79;NA;NA;NA;NA;NA;NA;NA;NA;NA;NA;NA;NA;NA;NA;NA;NA;NA;NA;NA;NA;NA;NA;27;0;0;0;0;0;0;1;3;4;0;0;1;1;0;0;2;0;0;NA;0;37;0;0;1;1;0;2;1;3;4;3;1;1;1;0;2;1;0;0;NA;5;NA;22;0;0;1;1;0;2;1;3;4;1;1;1;3;2;0;1;0;0;NA;0;36;0;0;1;1;1;3;1;3;4;3;1;1;3;2;2;1;0;1;NA;1;NA;49;0;0;1;1;1;3;1;3;4;3;1;1;2;1;2;4;0;0;NA;1
76;AE_PLF_4;81;31;0;0;0;1;Bus, loc, X, le goûter, rentrer;5;0;0;NA;pendant, et (2);2;1;0;1;1;2;1;0;2;1;0;NA;3;NA;NA;13;0;0;0;1;ajudar, pai, mãe, café;4;0;0;NA;0;0;0;0;0;1;2;1;2;3;0;0;1;NA;37;0;0;0;1;ferme, bus, faire du pain, animaux, partir;5;0;0;NA;et, après;2;1;0;1;3;3;1;2;3;0;1;NA;1;;NA;15;0;0;0;1;x, y, perder-se, ganhar;4;0;0;0;NA;0;0;0;0;3;2;0;2;2;0;1;2;NA;75;0;0;0;1;école , heure, maths, heure, gâre, X, attendre, se presenter, musée, manger, train, heure;12;0;0;NA;à 7h20, et (4), à 8h30, après (2);4;1;0;1;2;2;1;2;2;1;2;NA;4;;NA;NA;NA;NA;NA;NA;NA;NA;NA;NA;NA;NA;NA;NA;NA;NA;NA;NA;NA;NA;NA;NA;NA;NA;NA;PLF;f;1;f1;1;80;21;0;0;0;0;0;0;1;3;4;1;0;1;1;2;2;3;0;0;NA;1;NA;17;0;0;0;0;0;0;1;2;3;1;0;1;1;1;2;3;0;0;NA;3;23;0;0;0;0;0;0;1;3;4;1;0;1;1;1;1;3;1;0;NA;2;NA;15;0;0;0;0;0;0;1;3;4;0;0;1;1;0;2;2;0;1;NA;4;29;0;0;0;0;0;0;1;3;4;1;0;2;1;1;1;4;0;0;NA;2;NA;NA;NA;NA;NA;NA;NA;NA;NA;NA;NA;NA;NA;NA;NA;NA;NA;NA;NA;NA;NA;NA
77;AE_PLF_5;82;26;0;0;0;1;ferme, aller à la piscine, piscine;3;0;0;NA;pendant, après, et;3;1;0;1;1;3;0;2;3;0;4;NA;4;NA;NA;0;NA;NA;NA;NA;NA;NA;NA;NA;NA;NA;NA;NA;0;NA;NA;NA;NA;NA;NA;NA;NA;NA;présent mais rien écrit;18;0;0;0;1;aller à X, jouer au foot, rentrer;3;0;0;NA;NA;0;1;0;1;1;1;1;0;3;0;0;NA;5;;NA;10;0;0;0;1;mar, perder, alguém;3;0;0;0;NA;0;1;0;1;1;1;1;0;2;0;0;2;Moitié en portugais et l'autre moitié en français. Seulement la partie en portugais a été prise en compte pour l'analyse.;59;0;0;0;1;prof, arriver, glace, chips, jetter, partir, crier, rigoler, avertissements, rentrer, faire du français;11;0;0;NA;puis (3), et (2);2;0;0;0;3;2;0;2;2;0;0;NA;7;;NA;12;0;0;0;1;Portugal, correr, bicicleta, comer;4;0;0;NA;0;0;1;0;1;1;2;0;2;2;0;0;3;NA;PLF;f;1;f1;1;81;34;0;0;0;0;0;0;1;3;4;1;0;2;3;0;0;2;1;0;NA;4;NA;10;0;0;0;0;0;0;1;3;4;0;0;1;1;0;2;2;0;0;NA;3;21;0;0;0;0;0;0;1;3;4;1;0;1;1;1;0;2;0;0;NA;2;NA;14;0;0;0;0;0;0;1;3;4;0;0;1;1;0;0;2;0;1;NA;2;23;0;0;0;0;0;0;1;3;4;1;0;1;2;1;2;3;0;0;NA;2;NA;12;0;0;0;0;0;0;1;3;4;1;0;1;1;1;2;3;0;0;NA;0
78;AE_PLF_6;83;67;0;0;0;1;classe, la patinoire, à pied, jouer, la matinée, pause, manger et boire, s'enaller, glace,bphoto;10;0;0;NA;et (4), toute la matinée;2;1;0;1;3;3;0;0;2;0;1;NA;7;NA;NA;33;0;0;0;1;familia, italia, mar, amigos, festa;5;0;0;NA;0;0;1;0;1;0;2;0;0;2;NA;NA;NA;forte influence de l'italien en génerale, les verbes en italien;34;0;0;0;1;mon anniversaire, maison, jeux, trampolin, dessins, coche-coche, gâteau, cadeaux;8;0;0;NA;et;1;1;0;1;1;2;1;2;2;0;2;NA;1;;N'a pas respecté la ?, a écrit sur son anniversaire.;17;0;0;0;1;Portugal, jogar, amigas, comprar, x;5;0;0;0;NA;0;1;0;1;1;2;0;1;2;0;0;3;NA;67;0;1;1;0;anniversaire, jouer, jardin, gâteau, cadeaux, jouets, ipad;7;0;0;NA;et (2), et apres, toute la journee, apres;4;1;0;1;3;3;0;1;2;1;2;NA;2;;NA;28;0;0;0;1;Portugal, x, piscina, casa, mar, sobrinhos, amigas;7;0;0;NA;0;0;1;0;1;3;2;0;1;2;0;0;3;"influence de l'italien: ""eu sou andata"" (eu fui)";PLF;f;1;f1;1;82;59;0;0;1;1;0;2;1;1;2;0;1;1;1;0;0;0;1;2;NA;3;NA;43;0;0;1;1;0;2;1;2;3;0;1;1;1;0;0;2;0;0;NA;10;25;0;0;0;0;0;0;1;3;4;0;0;2;1;1;0;2;0;0;NA;1;NA;17;0;0;0;0;0;0;1;3;4;0;0;1;1;0;2;2;0;1;NA;2;59;0;0;0;0;0;0;1;3;4;1;0;2;1;2;0;4;0;4;NA;2;NA;23;0;0;1;0;0;1;1;3;4;2;1;1;1;1;2;3;0;0;NA;3
