270;O_PLD_11;307;27;0;0;0;1;"""Kinder, Harder, Spass, anstrengend, hochlaufen, runterfahren""";6;0;0;NA;"""und(1)""";1;1;2;3;1;3;0;0;2;0;0;1;0;nein;NA;53;0;0;0;1;dia de férias, festa, meninas, jogar, novela, volta, dia ;7;0;0;NA;22.3;1;0;0;0;3;3;0;1;2;1;0;3;majuscule de l'allemand, influence de l'Italie et de l'allemand;37;0;0;0;1;"""Swiss Holiday Park, schwimmen, kaltes Becken, essen, spielen, schön, Spass""";7;0;0;NA;NA;0;1;0;1;3;3;0;0;1;0;0;0;0;nein;NA;27;0;0;0;1;Europa park, medo, monstros, ir, vez;5;0;0;NA;0;0;1;2;3;3;3;0;1;2;0;0;3;NA;119;0;0;0;1;"""Schulreise, Swissholidaypark, 8:00 Uhr, Schule, Bus, ankommen, schwimmen, Gruppen, Ort, 12:00 Uhr, 13:00 Uhr, 16:00 Uhr, Kiosk, Schule, nach Hause, schöner Tag, 18:30 Uhr""";17;0;2;"""8:00 Uhr, 13:00 Uhr, 12:00 Uhr, bis um 16:00 Uhr, 18:00 Uhr, 18:30 Uhr""";"""danach(2), später(1), als(1), und(2)""";4;1;0;3;2;3;0;0;2;0;0;1;0;nein;NA;50;0;0;0;1;Dia, amiga, mar, casa, bola, comer, dormir, em cima, embaixo, acabar;11;0;0;NA;primeiro, depois (3);2;1;0;1;2;2;0;NA;2;0;0;5;influence de l'italien;PLD;d;1;d1;1;308;45;0;0;1;1;0;2;1;2;3;1;1;2;1;0;1;2;0;0;1;0;nein;29;0;0;1;0;0;1;1;2;3;1;1;1;3;1;1;1;0;0;NA;2;40;0;0;1;1;1;3;1;3;4;1;1;2;1;0;0;2;0;0;0;0;nein;40;0;0;1;0;0;1;1;2;3;0;1;2;1;0;1;2;0;0;NA;2;95;0;0;1;1;1;3;1;3;4;1;1;3;1;0;0;2;0;0;0;1;nein;31;0;0;1;0;0;1;1;3;4;2;1;1;1;1;2;3;0;0;NA;3
271;O_PLD_12;308;153;0;0;0;1;"""Klasse, Zoo, Tiere, Bären, Blatt, Sachen, Affen, lustig, erstes Mal, wunderschön, kleine etc., lustig, Kollegen, Pause, draussen, Eichhörnchen, rauf und runter, leise, niessen, erschrecken, weg, Rest der Tiere, parat, Zug, schön, zu Hause""";26;0;0;NA;"""und(3), und dann(1), dann(2)""";3;1;1;2;2;3;0;0;2;2;0;0;0;ja;der Eichhörnchen (esquilo --> masculin);276;0;0;0;1;data, acordar, partir, alemanha, carro, europapark, bilhetes, acabar, pai, amiga, mãe, montanha russa, alta, primeira vez, divertir-se, rosas, ferias, pausa, teatro, dia das bruxas, cabelos, ir embora, casa, pijama, quarto, jogar, livro, cama, dormir, sonhos;30;0;1;dia 6.10.2012;5.30 da manhã, 6.30 da manhã, 2 horas, primeiro, até a noite, 8 horas, 9.30 da noite, finalmente, e depois, depois, E(5);11;1;2;4;3;3;1;1;4;0;3;9;NA;131;0;0;0;1;"""Treffpunkt, 8:30, Kollegen, Bus, Alina etc., lustig, Grindelwald, ankommen, Parkplatz, Pause, halbe Stunde, gespielt, wandern, niemand wusste, hingehen, Zoo, Tiere, Reportage, Spielplatz, klettern, Rutschbahn, Spass, Schulreise""";23;0;2;"""8.30 Uhr, eine halbe Stunde""";"""und(5), danach(1), und dann(1)""";3;1;0;3;2;3;0;0;2;0;0;0;1;ja;NA;103;0;0;0;1;familia, parque de diversões, montanhas russas, europa park, crianças, coisas, teatro, vir, adultos, bonito, pagar, valer, andar, familia, amigos, 1,40 metro, andar, perigoso, rápidas, loucas, esperar;21;0;0;NA;0;0;1;0;1;3;3;0;1;2;1;1;11;NA;187;0;0;0;1;"""Velo, Schule, 2km, Bönigen, 20min, Zug, Pause, 20min, Schiff, 20min, Bus, 5min, laufen, nachmittags, Iselwald, Bauernhof, spielen, essen, Abend, Spiel, einschlafen, aufstehen, schon 6:30 Uhr, fit, aufräumen, Bus, Bönigen, Velo, 11.15 zu Hause""";29;0;2;"""5min, 3:45 Uhr nachmittags, etwa 20 Minuten, halb 7, am Abend, um 1:30 morgen, um 7 Uhr, 6:30 Uhr, um 11.15 Uhr""";"""und(5), und dann(2), und nachdem(1), dann(2), und nach(1)""";5;1;0;3;2;2;0;1;2;0;0;0;1;nein;NA;208;0;0;0;1;escola, passear, dormir, bicicleta, x, correr, y, comboio, almoçar, andar, chegar, preparar, jogar, jantar, salsicha, hamburguer, salada, melancia, melão, cama, adormecer, acordar, vestir-se, desporto, casa, deitar-se, acordar, arrumar, piscina, amigas, chover, trovejar, cair, molhada, banho, vestir-se, chá, prima, cama, dia, acordar, missa;42;0;0;NA;1 noite, quando (2), deopis (3), as 10h da noite, as 1h45 da manhã, de manhã, e depois, às 6:30, às 11h15, a noite, outra vez;11;1;0;1;3;2;0;2;2;1;0;12;NA;PLD;d;1;d1;1;309;106;0;0;1;1;1;3;1;2;3;2;1;3;2;0;0;2;0;0;3;1;nein;125;0;0;1;1;0;2;1;3;4;3;1;3;3;1;1;4;0;0;NA;10;116;0;0;1;1;1;3;1;2;3;2;1;3;1;0;0;2;0;0;1;2;ja;208;0;0;1;1;1;3;1;3;4;3;1;3;3;1;1;4;2;3;NA;15;143;0;0;1;0;0;1;1;3;4;1;1;3;1;0;1;2;0;0;4;1;nein;95;0;0;1;1;1;3;1;3;4;1;1;2;3;1;1;2;0;0;NA;9
272;O_PLD_13;309;41;0;0;0;1;"""Schule, laufen, Tiere, Flamingos etc., schön, essen, Spielplatz""";7;0;0;NA;"""nachher(1)""";1;1;2;3;2;3;0;0;0;0;0;1;0;ja;2 mots incompréhensibles;194;0;0;0;1;Portugal, avó, avô, irmão, primos, bola, dormir, comer, galinhas, patos, animais, coca cola, dilmes, tio, amigas, amigos;16;0;0;NA;0;0;1;0;1;3;2;0;1;2;0;10;5;unités thématiques incompletes (incompreensible ou en allemand, |f| ou |v| de l'allemand, 7.4 incomplet car incompréhensible ;43;0;0;0;1;"""Wald, Tiere, begegnen, Keckse, Biber, schön, Glück, regnen""";8;0;0;NA;"""und(1)""";1;1;0;1;2;3;0;0;2;0;0;0;1;nein;1 mot incompréhensible;63;0;0;0;1;acampar, amigos, x, medo, golfinhos, gostar, z;8;0;0;NA;0;0;0;0;0;3;3;0;0;2;0;0;10;bonne partie encomprehensible;NA;NA;NA;NA;NA;NA;NA;NA;NA;NA;NA;NA;NA;NA;NA;NA;NA;NA;NA;NA;NA;NA;NA;NA;NA;NA;NA;NA;NA;NA;NA;NA;NA;NA;NA;NA;NA;NA;NA;NA;NA;NA;NA;NA;NA;NA;NA;NA;NA;NA;PLD;d;1;d1;1;38;51;0;0;1;1;1;3;1;2;3;3;1;1;1;0;0;0;0;0;0;1;ja;35;0;0;1;1;0;2;1;0;1;0;1;2;3;0;1;2;0;0;NA;6;50;0;0;1;1;1;3;1;1;2;3;1;1;1;0;0;0;0;0;2;0;nein;71;0;0;1;0;0;1;1;2;3;0;1;1;1;0;1;2;0;0;NA;5;NA;NA;NA;NA;NA;NA;NA;NA;NA;NA;NA;NA;NA;NA;NA;NA;NA;NA;NA;NA;NA;NA;NA;NA;NA;NA;NA;NA;NA;NA;NA;NA;NA;NA;NA;NA;NA;NA;NA;NA;NA;NA;NA
273;O_PLD_14;310;16;0;0;0;1;"""Boot, schwimmen, Ice Cream, Zoo, Spass""";5;0;0;NA;NA;0;1;0;1;0;1;0;0;0;0;0;0;0;nein;NA;37;0;0;0;NA;dia de férias, bonecas, praia, piscina, pais;5;0;0;NA;0;0;0;0;0;NA;NA;0;1;2;0;2;3;a écrit au present;37;0;0;0;1;"""Schulreise, Swiss Holiday Park, schwimmen, Bus, Gruppen, am Schluss, Geld""";7;0;0;NA;"""am Schluss(1)""";1;1;2;3;3;2;1;0;1;0;0;1;0;nein;NA;21;0;0;0;1;martini, primas, brincar, divertir-se, giro;5;0;0;NA;0;0;1;0;1;3;3;0;1;2;0;0;1;NA;65;0;0;0;1;"""Swissholidaypark, Schwimmen, 4 Gruppen, nicht gut schwimmen, festhalten, Wasserrutsche, Spass, Sprudelbad, Farben, warm, Spass""";11;0;0;NA;NA;0;1;0;1;2;3;0;1;1;0;0;0;0;nein;NA;64;0;0;0;1;madeira, pais, tios, primos, hotel, piscina, comer, passear, prima, primo, piscina, comer, brincar, horas, cama;15;0;0;NA;primeiro, depois, a noite, às 10 horas;4;1;0;1;3;2;0;1;2;0;0;5;NA;PLD;d;1;d1;1;311;33;0;0;0;0;0;0;1;1;2;1;0;1;1;1;1;2;0;0;1;0;nein;22;0;0;1;0;0;1;1;2;3;2;1;1;3;1;2;1;0;0;NA;1;39;0;0;0;0;0;0;1;2;3;1;0;1;2;1;0;3;0;0;3;0;nein;36;0;0;0;0;0;0;1;3;4;1;0;2;1;1;1;1;0;0;NA;4;29;0;0;0;0;0;0;0;1;1;3;1;1;1;0;1;2;0;0;1;0;nein;37;0;0;1;0;0;1;1;3;4;3;1;2;2;1;1;4;0;0;NA;1
274;O_PLD_15;311;110;1;0;1;1;"""Schulreise, am Morgen, Bahnhof, Freunde, Bus, einsteigen, Grindelwald, Bahnhof, Talstation, Gondel, warten, Pause, fertig, Scheidegg, Wanderweg, Pause, Scheidegg, Bus, Bahnhof, schön""";20;0;2;"""am Morgen, 45 Minuten""";"""nachher(1), und dann(1), als(4)""";3;1;2;5;2;3;1;0;2;0;0;0;0;nein;NA;39;0;0;0;1;avião, Portugal, chegar, malas, carro, casa de férias, azeitão, semanas;8;0;0;NA;0;0;1;0;1;3;2;1;1;4;0;0;4;NA;78;0;0;0;1;"""Klasse, Kanton Uri und Schwyz, Luzern, Flüele, See, Morschach, SHP, Winter, nach draussen, warme Bäder etc., Rutsche etc., cool""";13;0;0;NA;NA;0;1;1;2;2;2;1;1;1;0;0;1;0;nein;NA;56;0;0;0;1;Portugal, sul, ponte 25 de abril, ponte vasco da gama, azeitõ, casa, zoológico, avó, saudades, amiga, vir, tempo, praia;13;0;0;NA;mais tarde;1;1;0;1;3;3;1;2;4;0;1;2;NA;39;0;0;0;1;"""Winterthur, Technorama, 3 Etagen, Vorstellungen, Wirbelstürme etc., Zug, Bus""";7;0;0;NA; ;0;1;0;1;2;2;1;0;2;0;0;0;1;nein;NA;47;0;0;0;1;avião, Portugal, avõ, tio, hospital, praia, nadar, coisas, lojas, comer, suiça;11;0;0;NA;no fim;1;1;0;1;3;2;1;1;3;0;2;0;NA;PLD;d;1;d1;1;312;44;0;0;1;0;0;1;1;3;4;2;1;1;1;0;1;2;1;0;1;1;nein;38;0;0;1;0;0;1;1;3;4;2;1;2;1;1;2;4;0;1;NA;3;41;0;0;1;0;0;1;1;3;4;2;1;2;2;0;1;2;0;0;0;0;nein;48;0;0;1;0;0;1;1;3;4;2;1;1;1;1;2;4;0;0;NA;3;33;0;0;1;1;1;3;1;2;3;3;1;2;1;1;1;2;0;0;0;1;nein;54;0;0;1;0;1;2;1;3;4;3;1;2;3;1;1;4;0;0;NA;2
275;O_PLD_16;312;15;0;0;0;1;"""Emmental, Gold waschen, Mann""";3;0;0;NA;"""und(1)""";1;1;0;1;1;2;0;0;0;0;0;0;0;ja;NA;30;0;0;0;NA;NA;NA;0;0;NA;0;0;1;0;1;1;NA;0;1;2;NA;NA;NA;incompreensible;26;0;0;0;0;"""Ferien, zu Hause, Faulenzen, Geburtstag, Kolleg""";5;0;0;NA;"""dann(1), und(1)""";2;1;0;1;1;2;0;0;0;0;0;0;0;nein;NA;20;0;0;0;1;casa, nada, aniversário, colega, x;5;0;0;NA;e depois, ao final;1;1;0;1;3;2;0;0;2;0;0;4;NA;68;0;0;0;1;"""Schulreise, Treffen, am Morgen, anziehen, Zug, Spiez, Schwimmbad, ankommen, erwarten, Kanu fahren etc., schöner Tag""";11;0;2;"""um 8:30, um 8:45, 9:00 Uhr, am morgen um 7:00""";"""dann(1), und(1)""";2;1;0;3;2;3;0;0;0;0;0;1;1;ja;1 mot incompréhensible;22;0;0;0;1;férias, Portugal, dia, festa, avô, avó;6;0;1;em julho;0;0;1;0;2;3;2;0;1;2;0;0;2;NA;PLD;d;1;d1;1;313;39;0;0;1;1;1;3;1;3;4;1;1;2;2;0;1;2;1;0;2;1;nein;NA;0;0;1;0;0;NA;1;0;NA;0;1;0;1;0;0;0;NA;NA;NA;NA;36;0;0;1;1;1;3;1;3;4;2;1;2;2;0;0;2;0;0;2;0;nein;22;0;0;0;0;1;1;1;2;3;0;1;1;1;0;0;2;0;0;NA;5;31;0;0;1;1;1;3;1;3;4;3;1;2;2;0;0;2;0;0;0;0;nein;19;0;0;1;1;1;3;1;3;4;3;1;1;1;0;1;1;0;0;NA;0
276;O_PLD_17;313;9;0;0;0;1;"""Wallis, Lötschental, Kirchen""";3;0;0;NA;NA;0;1;0;1;1;1;0;0;0;0;0;0;0;nein;NA;20;0;0;0;1;Portugal, piscina, festas avó, david carreira;5;0;0;NA;0;0;1;0;1;1;2;0;0;2;0;0;2;NA;21;0;0;0;1;"""Schulreise, Schule, grillieren, laufen""";4;0;0;NA;"""und dann(1)""";1;1;0;1;1;2;0;0;0;0;0;0;0;nein;NA;14;0;0;0;1;festas, férias, interlaken, colega;4;0;0;NA;0;0;1;0;1;1;2;0;0;2;0;0;1;NA;91;0;0;0;1;"""Schulreise, Spiez, treffen, D.C. Anlass, Langlauf, lustig, schneller, Glace, schneller, Glace, 39.04 Sekunden, 25.00 Sekunden, schnellste, Preis, Fotos""";15;0;2;"""39.04 Sekunden, 25.00 Sekunden""";"""und(2)""";1;1;2;5;1;2;0;0;0;0;0;1;1;nein;1 mot incompréhensible;33;0;0;0;NA;Portugal, sol, gente, avó, avô, ver, férias;7;0;0;NA;0;0;1;0;1;NA;NA;0;1;2;0;0;2;NA;PLD;d;1;d1;1;314;27;0;0;1;0;0;1;1;3;4;1;0;2;1;0;0;0;0;0;2;1;nein;8;0;0;0;0;0;0;1;0;1;0;1;0;1;0;0;0;0;0;NA;1;38;0;0;1;0;0;1;1;3;4;1;0;2;2;0;0;2;0;0;1;0;nein;20;0;0;0;0;0;0;1;3;4;0;0;1;1;0;1;2;0;0;NA;4;53;0;0;1;1;1;3;1;3;4;2;1;3;1;0;0;2;0;0;3;1;nein;48;0;0;1;1;1;3;1;3;4;1;1;2;1;0;0;2;0;0;NA;7
277;O_PLD_19;315;71;0;0;0;1;"""Schulreise, Horde, Klasse, Zug, laufen, eine Stunde, Pause, 20 Minuten, Bahnhof, 10 Minuten, Bus, zu Fuss, 2 Stunden, ankommen, Gondel""";15;0;2;"""eine Stunde, 20 Minuten, 10 Minuten, 2 Stunden""";"""zuerst(1), und dann(1), nach(1), dann(4)""";4;1;0;3;3;1;1;0;1;0;0;0;0;nein;NA;NA;NA;NA;NA;NA;NA;NA;NA;NA;NA;NA;NA;NA;NA;NA;NA;NA;NA;NA;NA;NA;NA;NA;NA;27;0;0;0;1;"""Brienzersee, Spass, Wasser, Essen, spazieren""";5;0;0;NA;"""danach(1), nach(1)""";2;1;0;1;1;1;0;0;0;0;0;0;0;nein;NA;55;0;0;0;1;paris, chegar, cõ, gato, olá, mala, casa, pai, dia, ver, passar;11;0;0;NA;0;0;1;0;1;3;2;0;2;2;0;0;9;NA;52;0;0;0;1;"""Klasse, Iseltwald, Spiele, Wasserschlacht, Fussball, 10.00, Bett, Freund, 4:00, wach, 7:00, aufstehen""";12;0;2;"""um 10:00, 4:00, um 7:00""";"""und(2)""";1;1;2;5;2;2;0;0;2;0;0;0;0;nein;NA;71;0;0;0;1;Portugal, mar, nadar, comer, volley, dormir, jogar, televisão, bonecos, brincar, comer, mãe, prenda, bola, jogo, cama, hotel, dormir;18;0;0;NA;muito tempo, depois ;2;1;0;1;2;2;0;1;2;0;0;5;NA;PLD;d;1;d1;1;316;49;0;0;1;0;0;1;1;3;4;1;1;2;1;0;0;2;0;0;0;0;nein;NA;NA;NA;NA;NA;NA;NA;NA;NA;NA;NA;NA;NA;NA;NA;NA;NA;NA;NA;NA;NA;28;0;0;1;1;1;3;1;3;4;2;1;2;1;0;0;0;0;0;0;0;nein;33;0;0;1;1;1;3;1;3;4;3;1;1;1;1;1;0;2;0;0;5;122;0;0;1;1;1;3;1;3;4;3;1;2;2;0;0;2;0;0;0;0;nein;58;0;0;1;0;0;1;1;3;4;0;1;2;2;0;1;2;0;0;NA;2
278;O_PLD_2;316;30;0;0;0;1;"""Laubbach, Fischzucht, grosse Fische etc., farbige Fische""";4;0;0;NA;NA;0;1;2;3;1;2;1;0;1;0;0;1;0;ja;NA;27;0;0;0;1;Portugal, amigos, futebol, avós;4;0;0;NA;0;0;1;0;1;3;2;1;1;2;0;2;1;majuscule de l'allemand;NA;NA;NA;NA;NA;NA;NA;NA;NA;NA;NA;NA;NA;NA;NA;NA;NA;NA;NA;NA;NA;NA;NA;NA;NA;NA;17;0;0;0;1;Portugal, avós, bicicleta, montes, mar;5;0;0;NA;0;0;1;0;1;1;2;1;2;1;0;0;2;NA;60;0;0;0;1;"""Museum, Thema Kunst, 9:00, Zug, 11:00, ankommen, 3 Gruppen, lustig, 12:00, essen, 12:30, Zug, 14:30, Interlaken""";14;0;2;"""9:00, 11:00, 12:00, 12:30, 14:30""";"""und(4)""";1;1;0;3;2;3;1;0;3;0;0;0;0;nein;NA;55;0;0;0;1;Portugal, avós, familia, mar, bicicleta, pai, ajudar, compras, sol, chuva, algarve, serpa;12;0;0;NA;0;0;1;0;1;3;2;0;1;3;0;0;2;NA;PLD;d;1;d1;1;317;25;0;0;1;0;0;1;1;3;4;1;1;2;1;0;0;2;0;0;0;0;nein;15;0;0;1;0;0;1;1;2;3;2;1;1;1;0;2;3;0;0;NA;2;27;0;0;1;0;0;1;1;2;3;2;1;2;2;0;2;2;0;0;0;0;nein;26;0;0;1;0;0;1;1;3;4;1;1;1;1;1;1;3;0;0;NA;3;44;0;0;1;0;0;1;1;3;4;2;1;2;1;1;0;3;0;0;0;0;nein;33;0;0;1;0;0;1;1;3;4;2;1;2;2;1;2;4;0;1;NA;3
279;O_PLD_20;317;5;0;0;0;1;"""Schulreise""";1;0;NA;NA;NA;NA;0;0;NA;NA;NA;0;0;0;0;0;0;0;nein;1 mot incompréhensible;NA;NA;NA;NA;NA;NA;NA;NA;NA;NA;NA;NA;NA;NA;NA;NA;NA;NA;NA;NA;NA;NA;NA;NA;NA;NA;NA;NA;NA;NA;NA;NA;NA;NA;NA;NA;NA;NA;NA;NA;NA;NA;NA;NA;NA;NA;NA;NA;NA;NA;19;0;0;0;1;x, amigo, y, cinema, pipoca, 2;6;0;0;NA;0;0;1;0;1;1;2;0;0;2;0;0;2;partie encomprehensible;41;0;0;0;1;"""Schulreise, Vögel, 6:30, Zug, Interlaken, 12:00, Vögel, Zmittag, nach Hause""";9;0;2;"""6:30 Uhr, 12:00""";"""dann(2)""";1;1;0;3;3;2;1;0;1;0;0;0;0;ja;NA;26;0;0;0;1;férias, irmão, mãe, pai, passear, jogar, brincar;7;0;1;as últimas férias;0;0;0;0;1;1;3;0;0;2;0;1;2;NA;PLD;d;1;d1;1;318;14;0;0;0;0;0;0;0;0;0;0;0;2;1;1;0;1;0;0;1;0;nein;NA;NA;NA;NA;NA;NA;NA;NA;NA;NA;NA;NA;NA;NA;NA;NA;NA;NA;NA;NA;NA;60;0;0;1;1;1;3;1;2;3;3;1;2;2;1;1;2;0;0;1;0;nein;24;0;0;0;0;0;0;1;3;4;0;1;1;1;1;2;2;0;0;NA;2;23;0;0;1;0;0;1;1;3;4;2;1;1;1;1;0;2;0;0;1;0;nein;23;0;0;1;0;0;1;1;3;4;0;1;1;2;1;1;3;0;0;NA;2
280;O_PLD_21;318;NA;NA;NA;NA;NA;NA;NA;NA;NA;NA;NA;NA;NA;NA;NA;NA;NA;NA;NA;NA;NA;NA;NA;NA;NA;NA;39;0;0;0;1;Macdonalds, piscina, camisola do benfica, caxicol, estádio, hotel, dormir;7;0;0;NA;e depois, depois, e (2);3;1;0;1;1;2;0;2;2;0;0;2;NA;NA;NA;NA;NA;NA;NA;NA;NA;NA;NA;NA;NA;NA;NA;NA;NA;NA;NA;NA;NA;NA;NA;NA;NA;NA;NA;NA;NA;NA;NA;NA;NA;NA;NA;NA;NA;NA;NA;NA;NA;NA;NA;NA;NA;NA;NA;NA;NA;NA;NA;92;1;0;1;1;"""Schulreise, erinner, 5.Klasse, 6.Klässler, See, 5km, Wald, Strecke, spielen etc., Füsse, Strömung, schwimmen, Wasserschlacht, Eis, Zug, Schulreise""";16;0;0;NA;"""dann(2), und(3)""";2;1;1;2;2;2;1;1;4;1;0;2;1;nein;NA;104;0;0;0;1;ferias, Portugal, natal, prendas, começo, primo, aeroporto, acidente, turbulência, porto, chegar, avô, levar, espinho, aveiro, familia, telemovel, feliz, suiça, férias ;20;0;1;as últimas melhores férias;depois (3), 2 semanas, outra vez;3;1;2;4;3;3;1;1;4;0;0;4;NA;PLD;d;1;d1;1;319;NA;NA;NA;NA;NA;NA;NA;NA;NA;NA;NA;NA;NA;NA;0;0;0;NA;NA;NA;NA;NA;28;0;0;0;0;0;0;1;3;4;1;0;1;1;1;2;4;0;0;NA;2;NA;NA;NA;NA;NA;NA;NA;NA;NA;NA;NA;NA;NA;NA;0;0;0;NA;NA;NA;NA;NA;NA;NA;NA;NA;NA;NA;NA;NA;NA;NA;NA;NA;NA;NA;NA;NA;NA;NA;NA;NA;NA;112;0;0;1;1;1;3;1;3;4;3;1;3;1;1;1;4;0;0;0;0;nein;107;0;0;1;1;1;3;1;3;4;3;1;3;2;1;2;4;0;0;NA;2
281;O_PLD_3;320;NA;NA;NA;NA;NA;NA;NA;NA;NA;NA;NA;NA;NA;NA;NA;NA;NA;NA;NA;NA;NA;NA;NA;NA;NA;NA;0;NA;NA;NA;NA;NA;NA;NA;NA;NA;NA;NA;NA;0;NA;NA;NA;NA;NA;NA;NA;NA;NA;A écrit en allemand;35;0;0;0;1;"""Hallenbad, Kutsche, Sprungbrett, Angst, springen, grosse Rutsche""";6;0;0;NA;"""dann(1), und(1)""";2;1;0;1;2;2;0;0;2;0;0;1;4;nein;difficile à déchiffrer;85;0;0;0;NA;NA;NA;0;0;NA;0;0;1;0;1;NA;NA;0;0;2;NA;NA;NA;impossible de compreendre;NA;NA;NA;NA;NA;NA;NA;NA;NA;NA;NA;NA;NA;NA;NA;NA;NA;NA;NA;NA;NA;NA;NA;NA;NA;NA;NA;NA;NA;NA;NA;NA;NA;NA;NA;NA;NA;NA;NA;NA;NA;NA;NA;NA;NA;NA;NA;NA;NA;NA;PLD;d;1;d1;1;39;NA;NA;NA;NA;NA;NA;NA;NA;NA;NA;NA;NA;NA;NA;NA;NA;NA;NA;NA;NA;NA;NA;20;0;0;0;0;0;0;1;1;2;0;0;1;1;0;0;2;NA;NA;NA;NA;39;0;0;1;0;0;1;1;2;3;1;1;2;1;0;0;2;2;0;0;0;nein;26;0;0;1;0;0;1;1;1;2;2;1;1;3;1;NA;3;0;0;NA;2;NA;NA;NA;NA;NA;NA;NA;NA;NA;NA;NA;NA;NA;NA;NA;NA;NA;NA;NA;NA;NA;NA;NA;NA;NA;NA;NA;NA;NA;NA;NA;NA;NA;NA;NA;NA;NA;NA;NA;NA;NA;NA;NA
282;O_PLD_4;321;53;0;0;0;1;"""Berg, Zug, Gondel, Berg, laufen, Wiese, Mittag, Wiese, Vögel, nahe""";10;0;0;NA;"""endlich(1), und nachher(1)""";2;1;2;3;2;2;1;0;1;1;0;2;1;nein;NA;66;0;0;0;1;Paris, disneyland, hotel, quarto, sala, piscina, restaurante, fonte, animais, diversões;10;0;0;NA;0;0;1;0;1;3;3;0;1;2;0;0;3;NA;25;0;0;0;1;"""Schulreise, 3. und 4. Klasse, Swiss Holiday Park, schwimmen, Spass""";5;0;0;NA;"""und(1)""";1;1;2;3;2;2;0;0;0;0;0;0;0;nein;NA;46;0;0;0;1;disneylandia, montanha russa, coisas, cansada, hotel, dentes, adormecer, levar;8;0;0;NA;e depois, ao final;2;1;0;1;3;2;0;1;2;0;0;2;NA;64;0;0;0;1;"""Schulreise, Dählhölzli, aufstehen, Sachen parat, 7:50, Schule, 8:05, Zoo, Tiere, Ort, Häuser, Themen""";12;0;2;"""7:20, 7:50, 8:05""";"""und(1), am Schluss(1)""";2;1;0;3;1;2;1;1;2;0;0;1;1;nein;NA;66;0;0;0;1;ferias, pai, Portugal, cão, di, lamber, acordar, aperceber-se, contente, férias, dia, pensar;12;0;0;NA;a meia noite;1;1;0;1;3;3;1;0;4;0;0;1;NA;PLD;d;1;d1;1;40;44;0;0;1;0;0;1;1;3;4;1;1;2;1;0;0;2;0;0;0;0;nein;20;0;0;0;0;0;0;1;3;4;1;0;2;1;1;1;3;0;0;NA;2;61;0;0;1;0;0;1;1;2;3;2;1;3;2;0;0;2;0;0;0;0;nein;30;0;0;1;1;1;3;1;3;4;2;1;1;3;0;1;3;0;0;NA;0;82;0;0;0;0;0;0;1;3;4;1;0;3;1;0;0;2;0;0;0;2;nein;52;0;0;0;0;0;0;1;3;4;1;0;2;3;1;0;4;0;0;NA;0
283;O_PLD_5;322;NA;NA;NA;NA;NA;NA;NA;NA;NA;NA;NA;NA;NA;NA;NA;NA;NA;NA;NA;NA;NA;NA;NA;NA;NA;NA;115;0;0;0;1;Portugal, irmã, prima, primo, dormir, tia, X, Y, mãe, comprar, jogo, colar, anel, calça, Z, brinco;16;0;0;NA;e depois;0;1;0;1;2;3;0;1;2;NA;NA;NA;des parties en allemand, majuscule de l'allemand, impossible d'analyser 7.4;NA;NA;NA;NA;NA;NA;NA;NA;NA;NA;NA;NA;NA;NA;NA;NA;NA;NA;NA;NA;NA;NA;NA;NA;NA;NA;19;0;0;0;1;férias, Portugal, primos, divertido, suiça;5;0;0;NA;e depois, ao final;1;1;0;1;1;3;1;1;4;0;0;3;NA;111;0;0;0;1;"""2.Klasse, Hinterburgseeli, weit, Ostbahnhof, toll, baden, Unterhosen, peinlich, kalt, Frösche, Hand, schön, ganz vorne, Gras, spielen, Fangis, Hinterburgseeli, Spass, wo""";19;0;0;NA;"""zuerst(1), und(2)""";2;1;0;1;2;3;2;1;2;1;0;4;2;nein;NA;53;0;0;0;1;carolina, semanas, Portugal, mãe, avós, tia, chorar, gostar, Portugal, setembro, saber, gastar, ir ;13;0;0;NA;1 semana, e outra semana ;2;1;0;1;3;3;0;1;2;0;2;1;NA;PLD;d;1;d1;1;41;NA;NA;NA;NA;NA;NA;NA;NA;NA;NA;NA;NA;NA;NA;NA;NA;NA;NA;NA;NA;NA;NA;11;0;0;1;0;0;1;1;0;1;0;1;0;1;1;2;1;NA;NA;NA;NA;NA;NA;NA;NA;NA;NA;NA;NA;NA;NA;NA;NA;NA;NA;NA;NA;NA;NA;NA;NA;NA;NA;21;0;0;1;0;0;1;1;2;3;1;1;2;1;1;1;3;0;0;NA;0;42;0;0;1;0;0;1;1;2;3;1;1;2;2;0;1;2;0;0;0;1;nein;0;0;0;0;0;1;1;1;3;4;3;1;2;2;1;2;4;0;0;NA;0
284;O_PLD_6;323;17;0;0;0;1;"""Schlittschuh, lustig, vorzeigen""";3;0;0;NA;NA;0;1;0;1;2;3;0;0;0;0;0;0;2;ja;NA;37;0;0;0;1;Portugal, ferias, mãe, pais, figueira da foz, calor, hotel;8;0;0;NA;0;0;1;0;1;3;3;0;1;2;0;0;1;majuscule de l'allemand;NA;NA;NA;NA;NA;NA;NA;NA;NA;NA;NA;NA;NA;NA;NA;NA;NA;NA;NA;NA;NA;NA;NA;NA;NA;NA;21;0;0;0;1;Portugal, amigos, divertido, suiça;4;0;0;NA;e depois, ao final;1;1;0;1;1;3;1;1;4;0;0;3;NA;67;0;0;0;1;"""7:00 Uhr, parat, Frühstück, Westbahnhof, Klasse, Zug, Thun, Wattenwil, bräteln, baden, nach Hause, zu Hause, duschen""";13;0;1;"""7:00 Uhr""";"""und(2), wenn(1), dann(2)""";3;1;2;4;1;2;1;0;2;0;0;2;1;nein;NA;35;0;0;0;1;Portugal, avós, pais, praia, dormir, hotel, casa;7;0;0;NA;quando, e depois;2;1;0;1;1;2;1;0;4;0;0;1;NA;PLD;d;1;d1;1;323;27;0;0;0;0;0;0;0;0;0;1;0;1;1;0;0;2;0;0;0;0;nein;16;0;0;1;0;0;1;1;2;3;2;1;1;1;1;0;3;0;0;NA;2;NA;NA;NA;NA;NA;NA;NA;NA;NA;NA;NA;NA;NA;NA;0;0;0;NA;NA;NA;NA;NA;24;0;0;1;0;0;1;1;2;3;3;1;2;1;1;2;3;0;0;NA;1;44;0;0;1;1;1;3;1;2;3;3;1;1;1;1;1;2;1;0;1;1;nein;40;0;0;1;1;1;3;1;2;3;3;1;1;3;1;2;4;0;0;NA;3
285;O_PLD_7;324;61;1;0;1;1;"""Grimmalp, Bus, gespielt, Mémorie etc., Statuen, am Mittag, Wurst, Spass, gespielt, Schule, Zug""";11;0;1;"""am Mittag""";"""und(4), und nachher(1)""";2;1;0;2;1;2;0;0;0;1;1;1;1;nein;NA;153;0;0;0;1;montanha, comboio, parc, irmã, roda, correr, cair, torre, fotos, restaurante, gelado, brincar, casa, carrinhos, cinto, gritar, casa, gato, livro, dormir, comer, dormir;22;0;0;NA;e depois (7), outra vez, e (7);3;1;0;1;3;2;0;1;2;0;0;2;NA;NA;NA;NA;NA;NA;NA;NA;NA;NA;NA;NA;NA;NA;NA;NA;NA;NA;NA;NA;NA;NA;NA;NA;NA;NA;NA;NA;NA;NA;NA;NA;NA;NA;NA;NA;NA;NA;NA;NA;NA;NA;NA;NA;NA;NA;NA;NA;NA;NA;NA;NA;NA;NA;NA;NA;NA;NA;NA;NA;NA;NA;NA;NA;NA;NA;NA;NA;NA;NA;NA;NA;NA;NA;NA;NA;NA;NA;NA;NA;NA;NA;NA;NA;NA;NA;NA;NA;NA;NA;NA;NA;NA;NA;NA;NA;NA;NA;NA;NA;NA;PLD;d;1;d1;1;42;21;0;0;0;0;0;0;1;3;4;1;0;1;1;0;0;2;0;0;1;0;nein;24;0;0;0;0;0;0;1;3;4;1;0;1;1;1;1;3;0;0;NA;4;NA;NA;NA;NA;NA;NA;NA;NA;NA;NA;NA;NA;NA;NA;NA;NA;NA;NA;NA;NA;NA;NA;NA;NA;NA;NA;NA;NA;NA;NA;NA;NA;NA;NA;NA;NA;NA;NA;NA;NA;NA;NA;NA;NA;NA;NA;NA;NA;NA;NA;NA;NA;NA;NA;NA;NA;NA;NA;NA;NA;NA;NA;NA;NA;NA;NA;NA;NA;NA;NA;NA;NA;NA;NA;NA;NA;NA;NA;NA;NA;NA;NA;NA;NA;NA;NA
286;O_PLD_8;325;NA;NA;NA;NA;NA;NA;NA;NA;NA;NA;NA;NA;NA;NA;NA;NA;NA;NA;NA;NA;NA;NA;NA;NA;NA;NA;38;0;0;0;1;Portugal, irmão, pai, bragança, primo, X, Y, Z;8;0;0;NA;0;0;1;0;1;1;2;0;1;2;0;0;1;des parties en allemand ;NA;NA;NA;NA;NA;NA;NA;NA;NA;NA;NA;NA;NA;NA;NA;NA;NA;NA;NA;NA;NA;NA;NA;NA;NA;NA;NA;NA;NA;NA;NA;NA;NA;NA;NA;NA;NA;NA;NA;NA;NA;NA;NA;NA;NA;NA;NA;NA;NA;NA;97;0;0;0;1;"""Schulreise, Ara, stank, 21 Kinder, langweilig, Kinder, Lehrer, dorthin, müde, stehen, Sonne, schwitzen""";12;0;0;NA;NA;0;1;1;2;2;3;1;1;2;0;0;0;0;ja;NA;35;0;0;0;1;Portugal, brincar, primos, x, mar, restaurantes, casa, pai, irmão;9;0;0;NA;0;0;1;0;1;2;2;1;1;3;0;0;4;NA;PLD;d;1;d1;1;325;NA;NA;NA;NA;NA;NA;NA;NA;NA;NA;NA;NA;NA;NA;0;0;0;NA;NA;NA;NA;NA;42;0;0;1;0;0;1;1;3;4;2;1;1;1;1;1;4;0;0;NA;1;NA;NA;NA;NA;NA;NA;NA;NA;NA;NA;NA;NA;NA;NA;0;0;0;NA;NA;NA;NA;NA;NA;NA;NA;NA;NA;NA;NA;NA;NA;NA;NA;NA;NA;NA;NA;NA;NA;NA;NA;NA;NA;26;0;0;0;0;0;0;1;1;2;1;0;1;2;1;1;1;0;0;0;0;nein;53;0;0;1;1;1;3;1;3;4;3;1;1;1;0;1;2;0;0;NA;3
287;O_PLD_9;326;28;0;0;0;1;"""Schulreise, Schwimmbad, Sprungbrett, 3m etc., 1.Klasse etc.""";5;0;0;NA;NA;0;1;2;3;2;2;1;1;0;0;0;1;1;nein;NA;61;0;0;0;1;Verão, irmão, fazer anos, tia, tio, primo, festa, sala, televisão, adormecer, tios, mora ;12;0;0;NA;a noite, e depois (2);2;1;0;1;1;2;0;1;2;0;0;4;NA;NA;NA;NA;NA;NA;NA;NA;NA;NA;NA;NA;NA;NA;NA;NA;NA;NA;NA;NA;NA;NA;NA;NA;NA;NA;NA;NA;NA;NA;NA;NA;NA;NA;NA;NA;NA;NA;NA;NA;NA;NA;NA;NA;NA;NA;NA;NA;NA;NA;NA;75;0;0;0;1;"""7.00 Uhr, aufstehen, angezogen, Zähne, Haus, Bahnhof, Blumenladen, Zug, aussteigen, Postauto, Wattenwil, wandern, Bach, bleiben, baden""";15;0;1;"""7:00 Uhr""";"""und(8), dann(4)""";2;1;2;4;1;2;0;0;1;0;0;0;1;nein;NA;37;0;0;0;1;padrinho, compras, convidar, jumbo, guimarães, gostar, ir;7;0;0;NA;0;0;1;0;1;3;3;1;1;4;0;0;1;NA;PLD;d;1;d1;1;326;33;0;0;1;0;0;1;1;1;2;1;1;2;1;1;0;2;0;0;0;0;nein;45;0;0;1;0;0;1;1;3;4;1;1;2;1;0;1;2;0;0;NA;3;NA;NA;NA;NA;NA;NA;NA;NA;NA;NA;NA;NA;NA;NA;0;0;0;NA;NA;NA;NA;NA;NA;NA;NA;NA;NA;NA;NA;NA;NA;NA;NA;NA;NA;NA;NA;NA;NA;NA;NA;NA;NA;36;0;0;1;1;1;3;1;3;4;3;1;2;2;1;0;2;0;0;0;0;nein;46;0;0;1;1;1;3;1;3;4;3;1;2;2;1;1;4;0;0;NA;3
332;S_CD_1;375;32;0;0;0;1;"""letztes Jahr, Skilager, Reiten, Spass, Lotto, schlafen, Rodeln, Baden, Spass""";9;0;1;"""letztes Jahr""";NA;0;1;0;2;3;3;1;0;1;0;0;0;0;nein;difficulté à séparer les mots ;NA;NA;NA;NA;NA;NA;NA;NA;NA;NA;NA;NA;NA;NA;NA;NA;NA;NA;NA;NA;NA;NA;NA;NA;73;0;0;0;1;"""Schmitten, laufen, Moos, Ziel, Äste, Stücke, Beige, Baumschere, Finger, geblutet, nicht weh, morgens bis abends, geschnitten, gehüpft, Spass""";15;0;1;"""morgens bis abends""";"""zuerst(1), und dann(1), und(1)""";3;1;0;2;2;3;1;1;2;0;0;0;0;nein;NA;NA;NA;NA;NA;NA;NA;NA;NA;NA;NA;NA;NA;NA;NA;NA;NA;NA;NA;NA;NA;NA;NA;NA;NA;57;0;0;0;1;"""Bauernhöfe, Zimmer, cool, Klasse, bitter, Müll, Bratwurstwettbewerb, cool""";8;0;0;NA;"""einmal""";1;1;0;1;2;3;1;1;1;0;0;0;0;nein;1 mot incompréhensible;NA;NA;NA;NA;NA;NA;NA;NA;NA;NA;NA;NA;NA;NA;NA;NA;NA;NA;NA;NA;NA;NA;NA;NA;CD;d;0;d0;1;372;55;0;0;0;0;0;0;1;3;4;1;0;3;1;0;1;2;0;0;0;0;nein;NA;NA;NA;NA;NA;NA;NA;NA;NA;NA;NA;NA;NA;NA;NA;NA;NA;NA;NA;NA;NA;119;0;0;0;1;0;1;1;3;4;2;1;2;1;0;0;2;0;0;0;0;ja;NA;NA;NA;NA;NA;NA;NA;NA;NA;NA;NA;NA;NA;NA;NA;NA;NA;NA;NA;NA;NA;55;0;0;1;0;0;1;1;3;4;2;1;2;1;1;2;2;0;0;0;0;nein;NA;NA;NA;NA;NA;NA;NA;NA;NA;NA;NA;NA;NA;NA;NA;NA;NA;NA;NA;NA;NA
333;S_CD_10;376;10;0;0;0;1;"""Legoland, Spass""";2;0;0;NA;NA;0;1;0;1;1;3;1;0;1;0;0;1;1;nein; ;NA;NA;NA;NA;NA;NA;NA;NA;NA;NA;NA;NA;NA;NA;NA;NA;NA;NA;NA;NA;NA;NA;NA;NA;25;0;0;0;0;"""weg, Frau H., Hund, wissen, ganzer Tag, gespielt""";6;0;1;"""den ganzen Tag""";NA;0;0;0;1;2;2;0;0;0;0;0;0;0;nein;1 mot incompréhensible;NA;NA;NA;NA;NA;NA;NA;NA;NA;NA;NA;NA;NA;NA;NA;NA;NA;NA;NA;NA;NA;NA;NA;NA;21;0;0;0;1;"""Murten, baden, sagen, Spass""";4;0;0;NA;"""und(1)""";1;1;0;1;2;3;0;0;0;0;0;0;0;nein;NA;NA;NA;NA;NA;NA;NA;NA;NA;NA;NA;NA;NA;NA;NA;NA;NA;NA;NA;NA;NA;NA;NA;NA;NA;CD;d;0;d0;1;373;28;0;0;0;1;1;2;1;3;4;2;0;1;1;0;0;2;0;0;0;0;nein;NA;NA;NA;NA;NA;NA;NA;NA;NA;NA;NA;NA;NA;NA;NA;NA;NA;NA;NA;NA;NA;32;0;0;0;1;1;2;1;3;4;2;0;1;1;1;0;2;0;0;0;0;nein;NA;NA;NA;NA;NA;NA;NA;NA;NA;NA;NA;NA;NA;NA;NA;NA;NA;NA;NA;NA;NA;33;0;0;1;1;0;2;1;3;4;3;1;2;1;0;0;2;0;0;0;0;nein;NA;NA;NA;NA;NA;NA;NA;NA;NA;NA;NA;NA;NA;NA;NA;NA;NA;NA;NA;NA;NA
334;S_CD_11;377;30;0;0;0;1;"""Betlehem, laufen, Felsbach, Wald, gespielt, gingen, Julia etc., abliegen""";8;0;0;NA;"""und danach(1), später(1), als(1)""";3;1;0;1;2;2;1;1;1;0;0;0;1;nein;NA;NA;NA;NA;NA;NA;NA;NA;NA;NA;NA;NA;NA;NA;NA;NA;NA;NA;NA;NA;NA;NA;NA;NA;NA;35;0;0;0;1;"""Schulreise, Grenzen, Schmitten, 3B, Betlehem, Filisdorf, Pause, zurück""";8;0;0;NA;"""zuerst(1), dann(2)""";2;1;2;3;2;2;1;0;1;0;0;0;0;nein;NA;NA;NA;NA;NA;NA;NA;NA;NA;NA;NA;NA;NA;NA;NA;NA;NA;NA;NA;NA;NA;NA;NA;NA;NA;48;0;0;0;1;"""höchster Punkt, zurück, am Morgen, Hohenzelg, Sirup, Reservoir, Pause, zurück""";9;0;1;"""am Morgen""";"""dann(1), und(2)""";2;1;1;3;1;2;0;0;1;0;0;0;0;nein;5 mots incompréhensibles, change au présent;NA;NA;NA;NA;NA;NA;NA;NA;NA;NA;NA;NA;NA;NA;NA;NA;NA;NA;NA;NA;NA;NA;NA;NA;CD;d;0;d0;1;374;65;0;0;1;1;1;3;1;3;4;3;1;2;1;0;1;2;0;0;0;0;nein;NA;NA;NA;NA;NA;NA;NA;NA;NA;NA;NA;NA;NA;NA;NA;NA;NA;NA;NA;NA;NA;49;1;1;1;1;1;5;1;1;2;3;1;3;1;1;1;3;0;0;0;0;nein;NA;NA;NA;NA;NA;NA;NA;NA;NA;NA;NA;NA;NA;NA;NA;NA;NA;NA;NA;NA;NA;51;1;1;1;1;1;5;1;3;4;3;1;2;3;2;2;4;0;0;0;0;nein;NA;NA;NA;NA;NA;NA;NA;NA;NA;NA;NA;NA;NA;NA;NA;NA;NA;NA;NA;NA;NA
